,text,result
0,terrible car crash,NO disaster
1,earthquake different stay safe,NO disaster
2,forest fire spot goose across cannot save,NO disaster
3,apocalypse wildfire,NO disaster
4,typhoon kill china,NO disaster
5,earthquake,NO disaster
6,probably still show life arsenal,NO disaster
8,nice,NO disaster
10,like,NO disaster
12,tell,NO disaster
15,wholesale market ablaze news fire break wholesale market,disaster
16,wear short race ablaze,NO disaster
17,toke marriage crisis set twitter,NO disaster
18,check,NO disaster
19,splitting follow burner follow ablaze,NO disaster
20,beware world ablaze sierra,NO disaster
21,burning man turban diva via,NO disaster
22,dis people take thing run eye opener set game ablaze,NO disaster
23,rape victim set girl burn injury set,NO disaster
24,setting ablaze,disaster
25,bin front field house wer set ablaze day flame went rite hydro pole wonder,NO disaster
26,ablaze pul radio,NO disaster
27,hope city hall build giant wooden mayoral effigy foot tall set,NO disaster
28,hurt eye ablaze,NO disaster
29,accident cranberry slow back traffic,NO disaster
30,got love burning self damn curling swear someone need take away accident,NO disaster
31,hate accident,NO disaster
32,car recorder car camera vehicle large,NO disaster
33,coincidence still unresolved secret past accident,NO disaster
34,accident near roundabout rather,NO disaster
35,pretend feel certain way feeling become genuine manga anime,NO disaster
36,legal medical referral service call accident dogbite,NO disaster
37,construction guy working store huge gauge ear bloody accident waiting happen,disaster
38,feel like going come,NO disaster
39,northbound junction currently delay min due accident,NO disaster
40,say met accident would super jelly,NO disaster
41,accident hit run cold block se vista police,NO disaster
42,accident like,NO disaster
43,please donate spread training accident left paraplegic,disaster
44,please like share new page indoor trampoline park aftershock opening,NO disaster
45,la pirate bay,NO disaster
46,schoolboy aftershock loud dear,NO disaster
47,dance,NO disaster
48,aftershock last team still way chief collins,NO disaster
49,dance,NO disaster
50,stop saying start saying unknown,NO disaster
51,want go aftershock band listen afford yet,NO disaster
52,still living aftershock people still scar bond,NO disaster
53,dance,NO disaster
54,aftershock,NO disaster
55,victory bargain basement,NO disaster
56,far best competitive map hope,NO disaster
57,brass copper cataclysm,NO disaster
58,happy use variation counter play style,NO disaster
59,aftershock,NO disaster
60,carelessness lead aviation accident victim right seek compensation,NO disaster
61,found guy accident airplane sending love support,NO disaster
62,girl airplane accident fifteen year ago,disaster
63,line know airplane accident near airport,disaster
64,airplane accident government age,disaster
65,horrible accident man wing,disaster
66,god accident happen airplane rest luggage completely please save,NO disaster
67,horrible accident man wing airplane,disaster
68,picture airplane,NO disaster
69,see judge accident,NO disaster
70,airplane mode accident,NO disaster
71,year ago today baseball lost one great airplane rip,disaster
72,expert begin examining airplane debris found reunion air accident expert,disaster
73,expert begin examining airplane debris found reunion air accident,disaster
74,expert begin examining airplane debris found reunion air accident expert,disaster
75,twelve feared air ambulance helicopter crash,disaster
76,dying send ambulance,NO disaster
77,ambulance sprinter automatic vehicle choice compliant,NO disaster
78,ambulance even well like nearly top car laughing,NO disaster
79,shot found dead cuff involved car officer told ambulance treat,NO disaster
80,call fag going call ambulance,NO disaster
81,new device able target destroy blood clot science,NO disaster
82,want send medic supply,NO disaster
83,heroin ambulance,NO disaster
84,twelve feared air ambulance helicopter crash,disaster
85,helicopter ambulance ride transfer hospital mile away cost,NO disaster
86,privileged wear ambulance uniform privileged,NO disaster
87,bartender work drunk man day,NO disaster
88,cop pull drunk driver safety second car hit via,disaster
89,cop pull drunk driver safety second car hit via,disaster
90,think un would move fraction chance,NO disaster
91,drama queen stand drama stage certainly never world would,NO disaster
93,step outside second get,NO disaster
94,well first strike minion,NO disaster
95,nature love burn become,NO disaster
96,shred psych work friendship would,NO disaster
97,example conservative burton liberal stood done nothing,NO disaster
98,crack regiment,NO disaster
99,everything,NO disaster
100,got,NO disaster
101,probably,NO disaster
102,longe mountain red hour,NO disaster
103,please sign save,NO disaster
104,allied plan annihilation german people,NO disaster
105,please share sign petition save wild horse,NO disaster
106,national park service national stop annihilation salt river wild via change,NO disaster
107,soul,NO disaster
108,update salt river wild horse via change,NO disaster
109,national park service national stop annihilation salt river wild via change,NO disaster
110,national park service national stop annihilation salt river wild via change,NO disaster
111,silent planet print annihilation,NO disaster
112,sign urgent stop annihilation salt river wild,NO disaster
113,get iced,NO disaster
114,national park service national stop annihilation salt river wild via change,NO disaster
115,national park service national stop annihilation salt river wild via change,NO disaster
116,like every defeat like annihilation,NO disaster
117,national park service national stop annihilation salt river wild via change,NO disaster
118,national park service national stop annihilation salt river wild via change,NO disaster
119,stop annihilation salt river wild via change,NO disaster
120,national park service national stop annihilation salt river wild via change,NO disaster
121,national park service national stop annihilation salt river wild via change,NO disaster
122,national park service national stop annihilation salt river wild via change,NO disaster
123,national park service national stop annihilation salt river wild via change,NO disaster
124,spherulitic almost feel like si sign,NO disaster
125,video futuristic house survive,NO disaster
126,video night lucky block apocalypse wither showcase,NO disaster
127,one major reason live ever come cue,NO disaster
128,zombie item right either screwed,NO disaster
129,apocalypse,NO disaster
130,excited apocalypse really dig franchise going like theme,NO disaster
131,sound like terrible right,NO disaster
132,apocalypse artist go exclusion zone ura,NO disaster
133,southern apocalypse apocalyptic doomsday book reading,NO disaster
134,honestly could say apocalypse coming would he enthusiastic everything,NO disaster
135,also nephew proof fat baby going save apocalypse,NO disaster
136,video zombie rescue,NO disaster
137,added video futuristic house survive map,NO disaster
138,prince encounter meerkat,NO disaster
139,video night lucky block apocalypse wither showcase,NO disaster
140,zombie apocalypse among,NO disaster
141,video night lucky block apocalypse wither showcase,NO disaster
142,universal order,NO disaster
143,patent pending stream,NO disaster
145,might rise ash true,NO disaster
146,turkey halfway,NO disaster
147,remember crowd around baggage like bag last food item earth,NO disaster
148,never even face,NO disaster
149,issue major warning late escape,disaster
150,da one spear,NO disaster
151,build army lion leader dog fight lion die like,NO disaster
152,one direction pick fan army,NO disaster
153,shark army black date stainless steel quartz men sport watch full read,NO disaster
154,pick fan army,NO disaster
155,second summer pick fan army,NO disaster
156,pick fan army,NO disaster
157,swiss army date rubber mop watch,NO disaster
158,hope salvation army least gave tax,NO disaster
159,one direction pick fan army,NO disaster
160,one direction pick fan army,NO disaster
161,one direction pick fan army,NO disaster
162,check data upper reservoir,NO disaster
163,came sixteenth year go forth head army,NO disaster
164,one direction pick fan army,NO disaster
165,second summer pick fan army,NO disaster
166,report arson charge county house fire,NO disaster
167,arson suspect linked fire caught northern,disaster
168,police unable solve case duma arson attack,NO disaster
169,shock setting wildfire across,NO disaster
170,time like arson push past felony,NO disaster
171,mourning notice stabbing arson victim stir poster,disaster
172,mourning notice stabbing arson victim stir poster,disaster
173,probation two year pay fine,NO disaster
174,police sketch arson,NO disaster
175,fire winery arson,NO disaster
176,trial date set man arson,NO disaster
177,man connection arson man court accused,NO disaster
178,police arrest possible arson investigation,NO disaster
179,rip arson,NO disaster
180,arson suspect linked fire caught northern,disaster
181,owner gay bar arson scheme,NO disaster
182,news owner gay bar arson frank via,NO disaster
183,mourning notice stabbing arson victim stir poster,disaster
184,contra costa authority arrest suspected serial authority believe,NO disaster
185,owner gay bar arson frank guilty arsonist,NO disaster
186,man,NO disaster
187,mo way say,NO disaster
188,arsonist set vegetarian restaurant police,NO disaster
189,arsonist torch house getaway vehicle police say surrey leader,disaster
190,already threw away letter tho,NO disaster
191,hotel arsonist damage arsonist court,NO disaster
192,suspected serial arsonist east bay arrest,disaster
193,arsonist walk gospel,NO disaster
194,bitch dont get,NO disaster
195,new vine,NO disaster
196,suspected serial arsonist,disaster
197,surveillance video capture man removing flag long beach home,disaster
198,serial arsonist get bail jail release,disaster
199,arson suspect linked fire caught northern,disaster
200,government provide free treatment acid attack victim private hospital,disaster
201,going panic attack,NO disaster
202,end innovation reduce attack surface,NO disaster
203,yesterday heat attack funny relationship,NO disaster
204,gratuitously cruel attack dying,NO disaster
205,cooper super hero dog saved heart attack knew,NO disaster
206,double ebony attack,NO disaster
207,suspect latest attack psychological issue,disaster
208,people tilly confused cat horrible attack win heart,NO disaster
209,love love love massive attack angel,NO disaster
210,many article attack labour defend see,NO disaster
211,attack freedom information liberty,NO disaster
212,weird near panic attack write bathroom work nearly dreadfully miss,NO disaster
213,black attack white married slut,NO disaster
214,cop injured militant attack police suspected militant police post,disaster
215,schoolgirl park led former friend,NO disaster
216,need career best along smith even try sura virus team brutally,NO disaster
217,temple mount waving flag via,disaster
218,temple mount waving flag via,disaster
219,man police family,NO disaster
220,temple mount waving flag via,disaster
221,temple mount waving flag via,disaster
222,total free,NO disaster
223,result constantly,NO disaster
224,forgot memo getting resident concussion funny,NO disaster
225,temple mount waving flag via,disaster
226,fire nation,NO disaster
227,temple mount waving flag via,disaster
228,police simply thank protecting via,NO disaster
229,peaceful happy twitter experience,NO disaster
230,car tube installation avalanche sound output,NO disaster
231,true throw head avalanche,NO disaster
232,glance avalanche one look heartbeat oh walk moon get said,NO disaster
233,repost avalanche charging,NO disaster
234,dad told would never let get avalanche,NO disaster
235,imagine plenty talk math teacher similar age music,NO disaster
236,vintage collectable avalanche spray,NO disaster
237,plus performance chip fuel saver chevy,NO disaster
238,sen looking consistency avalanche,NO disaster
239,avalanche need anyone carry,NO disaster
240,musician classic album cover clever music video,NO disaster
241,frozen fury king avalanche grand,NO disaster
242,maid agency present musician classic album cover clever music video,NO disaster
243,avalanche rear axle assembly,NO disaster
244,senator another year determine,NO disaster
245,avast avalanche,NO disaster
246,colorado avalanche duck ticket preseason,NO disaster
247,listen avalanche take deep breath,NO disaster
248,men lunatic,NO disaster
249,environment lone pine tree growing across country remembrance battle year,NO disaster
251,raspy cool already figured battle,NO disaster
252,video omega ruby alpha sapphire battle,NO disaster
253,long battle spur took care knockout,NO disaster
254,video knuckle punch death,NO disaster
255,around grow via,NO disaster
256,longer transport germ wake anthrax lab mishap,disaster
257,longer transport germ wake anthrax lab mishap via,disaster
258,longer transport germ wake anthrax lab mishap via,disaster
259,consequence went pathogen,NO disaster
260,longer transport germ wake anthrax lab,disaster
261,latest safety longer transport anthrax select agent research specimen,NO disaster
262,longer transport germ wake anthrax lab mishap,disaster
263,stop shipping potential longer deliver package,disaster
264,citizen education project year watchdog dugway proving,NO disaster
265,longer transport germ wake anthrax lab mishap,disaster
266,longer transport germ via,NO disaster
267,offbeat news stopped shipping pathogen,NO disaster
268,longer transport germ wake anthrax lab mishap news,disaster
270,attack soil involved,NO disaster
271,time hedge catastrophic risk climate change asteroid impact,NO disaster
272,take make look id still,disaster
273,guideline medical public health management,disaster
274,drone reach large,NO disaster
275,way mean,NO disaster
276,forget threat,NO disaster
277,discus rogan question pathogen virus,NO disaster
278,discus rogan question,NO disaster
279,take make look id still,disaster
280,seen front line fight,NO disaster
281,living assault thing low risk,NO disaster
282,anthrax,NO disaster
283,take make look id still,disaster
284,guideline medical public health management hen,disaster
285,fight,NO disaster
286,fight,NO disaster
287,good mine could better alright,NO disaster
288,trip keep id forfeit due,NO disaster
289,add dont even know talking,NO disaster
290,never got give might well blaze another one,NO disaster
291,yeah creamy white stuff,NO disaster
292,reaction,NO disaster
293,port fire crew say electric towel warmer four alarm blaze last week several,NO disaster
294,video blaze drive,NO disaster
295,craving,NO disaster
296,need go like yesterday,NO disaster
297,blaze,NO disaster
298,homeless blaze near,NO disaster
299,eat blaze,NO disaster
300,big buzzy kame home year,NO disaster
301,banging,NO disaster
302,bitch say hot say bitch blazing,NO disaster
303,need blazing think watt far impressive another quick little guy,NO disaster
304,checked blazing horse tattoo yelp,NO disaster
305,midnight song cry go reality reality erased blazing sun,NO disaster
306,ever blazing,NO disaster
307,ready go meet bring blazing sunshine fun time,NO disaster
308,old lady town delta,NO disaster
309,enjoying shade sun blazing cool west park,NO disaster
310,happening rescue blazing blasting air,NO disaster
311,night insomnia whole stop blazing real,NO disaster
312,series wildfire northern continue least five fire,NO disaster
313,hosting get blazing speed professional management unlimited option,NO disaster
314,come join trail diversified world,NO disaster
315,old lady town delta,NO disaster
316,hot blazing even though wildfire going even big massive rocky fire,NO disaster
317,people understand cant bleeding tweet everyone head hardly,NO disaster
318,house near bleeding company,NO disaster
319,wish could watch gif account posted,NO disaster
320,lewis ever see video singing bleeding,NO disaster
321,cool read though may look,NO disaster
322,cut open keep singer,NO disaster
323,bleeding,NO disaster
324,promise bleeding rio whooping trick,NO disaster
325,look like coming need stop best performance,NO disaster
326,stabbing really affect get stab wound bleeding backwards,NO disaster
327,yeah hate cat tried pet cat hand bite mark scratch mark,NO disaster
328,wrap cloth wound still bleeding fall ground going die,NO disaster
329,ear bleeding,NO disaster
330,bad eye ear bleeding,NO disaster
331,want quit even bleeding,NO disaster
332,quickly get popular,NO disaster
333,snap,NO disaster
334,get follow back,NO disaster
335,damn,NO disaster
336,wow social medium really twain concert,NO disaster
338,always one phone call away many people done chance,NO disaster
339,well tweet fast,NO disaster
340,well sleeping,NO disaster
341,poor white guy made pizza mac cheese sad,NO disaster
342,wow believe funny clever person like,NO disaster
343,either till mention,NO disaster
344,around map work yeah think,NO disaster
345,stadium,NO disaster
346,balloon thing rude would balloon whoever face,NO disaster
347,yeah true got exposed probably went,NO disaster
348,reason ego cause cod champ strictly look,NO disaster
349,kick loan effort,NO disaster
350,land bank target first latrobe building property acquisition fight,NO disaster
351,lot talk susceptible shoot blight without,NO disaster
352,help fight northern corn leaf blight headline,NO disaster
353,cole,NO disaster
354,imagine old god start blight,NO disaster
355,blight barn hickory road near,NO disaster
356,height shaker height fight blight via,NO disaster
357,keep great work councilman,NO disaster
358,blight every day,NO disaster
359,like leave snide person blight upon face earth,NO disaster
360,important inquisition fighting one get blight entire game,NO disaster
361,member blight ordinance said success property change hand,NO disaster
362,time ripe yet another banana appeal future banana,NO disaster
363,red eye crossing potato servile,NO disaster
364,made progress blight many burned shell house,NO disaster
365,per sun piece last year think opposite urban blight,NO disaster
366,renewable energy agree horrible blight landscape,NO disaster
367,mop,NO disaster
369,literally lunch cheese curd dinner blizzard pray health,NO disaster
370,oh see blizzard,NO disaster
371,check new sale lizard stuck,NO disaster
372,deck building year old daughter,NO disaster
373,blizzard,NO disaster
374,storm siege gaming glass wow blizzard full,NO disaster
375,game drove blizzard,NO disaster
376,horrible moment open look like snowy blizzard left piece paper jean pocket,NO disaster
377,blizzard another month sub thing gave next wow free would knock sub count pretty high,NO disaster
378,sending subliminal message ice cream therefore need blizzard,NO disaster
379,new legend,NO disaster
380,relate jean ur also enjoy blood dance floor,NO disaster
381,seen blood,NO disaster
382,bring horizon blood giant art print panel poster,NO disaster
383,thing,NO disaster
384,bitch monster good blood sucker,NO disaster
385,golden,NO disaster
386,make related loyalty make,NO disaster
387,remind blood,NO disaster
388,reason blood pressure medicine,NO disaster
389,gay men donate,NO disaster
390,new blood come make sure,NO disaster
391,penny post octagonal black grid cancel,NO disaster
392,seeing blood surgery regular behind desk say dentist real doctor,NO disaster
393,sometimes blood water sometimes family bring stranger,NO disaster
394,type,NO disaster
395,whole new shouting join radio,NO disaster
396,whats bloody use bus everything one driving bus,NO disaster
397,best guest episode bloody,NO disaster
398,bloody hot room,NO disaster
399,bloody excited see,NO disaster
400,buy new one bloody ell,NO disaster
401,twitter since bloody,NO disaster
402,awful ruined balance guy bloody mess,NO disaster
403,bloody hell brain,NO disaster
404,swear eye bloody red bitch feel,NO disaster
405,anyway running mouth bloody sure bigger calm hell,NO disaster
406,bloody nurse waking eventually fall asleep hospital,NO disaster
407,deal right bloody,NO disaster
408,nightmare elm getting via,NO disaster
409,bloody hell teen wolf cute think jeep dead huh,NO disaster
410,luckily cause came cut grass early full blown attitude,NO disaster
411,nobody wit busy yo get blown,NO disaster
412,yes know yes smoke blown ur,NO disaster
413,whole thing blown face right wrong public relentless court public opinion,NO disaster
414,understand white post blown,NO disaster
415,getting blown poster,NO disaster
416,license picture blown absolutely,NO disaster
417,deadly suicide hit mosque suicide bomber blown mosque,disaster
418,phone blown,NO disaster
419,due get blown least still winnable,NO disaster
420,lock last shred manhood accept full blown sissy,NO disaster
421,get blown delicious flavor strawberry cherry try today,NO disaster
422,run rain blown,NO disaster
423,blown twitter look,NO disaster
424,hope get blown drone attack whilst visiting family,NO disaster
425,blown away support even hung,NO disaster
426,first thought pretty sure post year,NO disaster
427,new lady shoulder tote handbag leather hobo purse cross body bag woman full,NO disaster
428,cute soft washed fabric camouflage outdoor shoulder bag pack purple camouflage,NO disaster
429,cross body bag purse zipper shoulder bag camouflage phone case camera case wallet wallet wallet,NO disaster
430,monogram limited edition clutch cross body bag full read,NO disaster
431,digital camera body battery carry bag charger,NO disaster
432,brown cross body shoulder bag monogram full,NO disaster
433,vampire cross body small shoulder bag,NO disaster
434,diesel printed front cross body shoulder bag one size,NO disaster
435,new lady shoulder tote handbag woman cross body bag leather fashion purse full,NO disaster
436,digital camera body battery carry bag charger,NO disaster
437,new lady shoulder tote handbag leather hobo purse cross body bag woman,NO disaster
438,would love win amazing filled beauty bag content body shop,NO disaster
439,parenthood employee laugh aborted baby body part mixed together,NO disaster
440,new lady shoulder tote handbag leather hobo purse cross body bag woman,NO disaster
441,body bag,NO disaster
442,bag via daily deal,NO disaster
443,genuine leather man bag messenger fit tablet case cross body air full,NO disaster
444,think time cause drake done body bagging,NO disaster
445,people bagging love body like probably dude skinny jean,disaster
446,bagging last spot body attack,NO disaster
447,dear lord forgive body bagging amen drake,NO disaster
448,first second body bagging sight,NO disaster
449,drake really body bagging meek,NO disaster
450,remember halo interview time devil body bagging,NO disaster
451,artist pay homage late great small body bagging hypnotize,NO disaster
452,drake kill meek mill bagging dead body,disaster
453,man start body bagging local photographer,NO disaster
454,body,NO disaster
455,drake body bagging meek,NO disaster
456,body bagging think time bring bag,NO disaster
457,need stop paying attention body bagging worry bout happen,NO disaster
458,hear north body bagging never got spitter south,NO disaster
459,even drake killing game really watered singing body bagging,NO disaster
460,used werewolf also tea bagging body like minute fighting someone else,NO disaster
461,movie via,NO disaster
462,man need defenseless thug cop get get put cool new body,NO disaster
463,body bag,NO disaster
464,coming home body kingdom,NO disaster
465,hot lady handbag leather shoulder tote satchel messenger cross body bag green handbag,NO disaster
466,investigating post saying police put body,NO disaster
467,mistake come back body leading world armed force,NO disaster
468,woman stylish metal chain pearl solid shoulder cross body bag golden,NO disaster
469,woman flower printed shoulder handbag cross body metal chain satchel bag pink,NO disaster
470,one top tweet japan young person know anniversary bomb,NO disaster
471,mark year since city mark anniversary,disaster
472,last year platinum artist,NO disaster
473,coming bomb teacher never final went salt grass bought food,NO disaster
475,rip time atom bomb,NO disaster
476,kerry barry got taken making bomb talk went,NO disaster
477,think bomb raise sort great question one,NO disaster
478,censor account suffering,NO disaster
479,hit atomic,NO disaster
481,sex bomb yo,NO disaster
482,hansel witch bomb as late,NO disaster
483,mark amid fear eroded pacifism japan,NO disaster
484,bomb,NO disaster
485,aunt gave drink game never tell though,NO disaster
486,giving minute enjoy famous architect time bombed skyscraper,NO disaster
487,photo bombed princess,NO disaster
488,get call back interview thought bombed,NO disaster
489,hour yr ago one act mass murder world history,disaster
490,year ago bombed say,NO disaster
491,look like bombed look monster,NO disaster
492,bombed nuclear weapon little plane gay,disaster
493,deal either deal abandon program get deal right wing love,NO disaster
494,picture cute sleeping puppy photo bombed demon,NO disaster
495,remind bombed asylum applicant,NO disaster
496,get,NO disaster
497,bombed fake bolt chat everyone thought bolt ended,NO disaster
499,dont really talk murder campaign murder,NO disaster
500,mark anniversary atomic via world,disaster
501,japan mark anniversary atomic,disaster
502,japan mark anniversary atomic,disaster
503,like survive atomic,disaster
504,anniversary,NO disaster
505,japan mark anniversary atomic,disaster
506,mark anniversary atomic associated press via,disaster
507,atomic japan,NO disaster
508,japan mark anniversary atomic bell japan,disaster
509,japan mark anniversary atomic,disaster
510,yr since atomic terrible mass,NO disaster
511,breaking collapse hapless bridge,NO disaster
512,project plan united,NO disaster
513,two giant crane holding bridge collapse nearby home,disaster
514,currently building church third bridge likely collapse,NO disaster
515,throwback thought citizen medium bridge collapse disaster,disaster
