,text,result
1975,get massive turn away labour electoral credit tory much,NO disaster
1976,likely landslide victim assistance,NO disaster
1977,many landslide told loose even get upper caste vote,NO disaster
1978,artifact found southern landslide near horseshoe casino,NO disaster
1979,actually funny remains relatively static character series far suddenly like landslide,NO disaster
1980,video landslide,NO disaster
1981,possibly mean majority,NO disaster
1982,sum give historic landslide everything king,NO disaster
1983,go dungeon landslide,NO disaster
1984,need seeing technical writing administer,NO disaster
1985,dixie chick landslide sail ocean handle season,NO disaster
1986,seek emergency repair boulevard,NO disaster
1987,far landslide high exploit even statesmanlike final draft,NO disaster
1988,get excited watch lava animated short inside learn,NO disaster
1989,mostly around lava,NO disaster
1990,lava,NO disaster
1991,jordan son mar hot lava release via,NO disaster
1992,watch steak grilled molten hot lava,NO disaster
1993,lava iris,NO disaster
1994,make lava,NO disaster
1995,lava,NO disaster
1996,lava blast dan power red,disaster
1997,game tell stop going nether spawning right,NO disaster
1998,white pink lava lava bead bracelet silver tone,NO disaster
1999,gain super power lava girl throw chest wrapped chain sink bottom,NO disaster
2000,lava blast power red mix,NO disaster
2001,said domino lava cake better culinary cuisine,NO disaster
2002,lava boy taken,NO disaster
2003,lava,NO disaster
2004,get heavy rain barely festival lightning close,disaster
2005,science lightning rock atomic level,disaster
2006,world war book lightning joe autobiography general collins,NO disaster
2007,get heavy rain barely festival lightning close,disaster
2008,baby like lightning bottle,NO disaster
2009,lightning,NO disaster
2010,southeast regional lightning buckle folk take,NO disaster
2011,certified lightning cable,NO disaster
2012,lightning express golf trolley fix ramify pretty much multitudinal area thine,NO disaster
2013,world war book lightning joe autobiography general collins,NO disaster
2014,democracy,NO disaster
2015,bang phenomenal,NO disaster
2016,two film university student selected student academy award lightning,NO disaster
2017,get heavy rain barely festival lightning close,disaster
2018,lightning,NO disaster
2019,red thunder blonde lightning back,NO disaster
2020,lightning spring boom scoreless seventh inning,NO disaster
2021,soon loud bang,NO disaster
2022,breaking loud bang blast wind,NO disaster
2023,breaking loud bang blast wind,NO disaster
2024,breaking loud bang blast wind,NO disaster
2025,breaking loud bang blast wind,NO disaster
2026,breaking loud bang blast wind,NO disaster
2027,breaking loud bang blast wind,NO disaster
2028,breaking loud bang blast wind,NO disaster
2029,breaking loud bang blast wind,NO disaster
2030,breaking loud bang blast wind,NO disaster
2031,really loud bang outside bedroom door afraid,NO disaster
2032,man loud find baby via,NO disaster
2033,school ignorant as ugly want seen girl want as,NO disaster
2034,bang,NO disaster
2035,loud bang outside see floor window every room baseball bat,NO disaster
2036,breaking loud bang blast wind,NO disaster
2037,amaas carry way get stop mass murder,disaster
2038,candlelight vigil house tonight victim mass ant murder bathroom,NO disaster
2039,start making displeased noise struggle get twisted mass blanket,NO disaster
2040,socialism mean mass,NO disaster
2041,watching murder first get perspective family mass shooter crazy pain,NO disaster
2042,duck socialism mean mass,NO disaster
2043,yr since atomic terrible mass,NO disaster
2044,mass murder,disaster
2045,plane debris word mass murder,disaster
2046,give verse directly mandate terrorism genocide would like,NO disaster
2047,calling men rise commit mass,NO disaster
2048,please take itinerary mass murder dolphin whale,disaster
2049,subject mass,NO disaster
2050,today mark year since mass murder civilian end,disaster
2051,would go mass murder mistake made,disaster
2052,amazing smug guy use mass murder global power,disaster
2053,like mass think get gun illegally,NO disaster
2054,movement impeach sa accused helping mass murderer escape,disaster
2055,also mass,NO disaster
2056,president hosting terrorist,NO disaster
2057,shooting movie theater new mass murderer,disaster
2058,stereotyping mass murderer like,disaster
2059,wait really tell wife mass murderer cheat done film,disaster
2060,worth via,NO disaster
2061,tomb raider uncharted game croft drake finally run ruthless mass murderer recent,disaster
2062,disgusted libertarianism mass murderer innocent,disaster
2063,mass murderer sex without touching taking clothes fanatical hygiene,disaster
2064,sound pretty sensible mass,NO disaster
2065,mass murderer told judge use right ask jury mercy,disaster
2066,also nicely fandom mass murderer know,disaster
2067,people create rumor matter bottom line giving fifteen minute fame mass murderer,disaster
2068,king king,NO disaster
2069,trillion dollar lawsuit sandy hook,NO disaster
2070,embrace beauty massacre lie ahead,NO disaster
2071,year temple massacre prevention key,NO disaster
2072,birthday,NO disaster
2073,want popcorn tea watching massacre,NO disaster
2074,colorado theater shooting victim fear copycat,disaster
2075,person would possibly make horror film vista massacre order make money,NO disaster
2076,one year massacre broken people,NO disaster
2077,un massacre thousand need lesson,NO disaster
2078,police link beach massacre museum,disaster
2079,letter massacre provide meat table red haired warrior gone forever,NO disaster
2080,thus end clam massacre clambake,NO disaster
2081,night massacre year later firing still day infamy,NO disaster
2082,tonight going mayhem everybody free st,NO disaster
2083,adventure terrarium join,NO disaster
2084,editor chief release issue fashion model mayhem,NO disaster
2085,slayer low mayhem festival attendance king diamond jeff passing,NO disaster
2086,fan back sadly even went got,NO disaster
2087,attack mayhem investigation agency chief,NO disaster
2088,wed mayhem event,NO disaster
2089,episode dash preview season kick designer new,NO disaster
2090,mayhem husband,NO disaster
2092,slayer mayhem festival slayer metal,NO disaster
2093,tonight going mayhem everybody free st,NO disaster
2094,tonight going mayhem everybody free st,NO disaster
2095,bank art center man,NO disaster
2096,el getting monster weather system may bring relief could cause,NO disaster
2097,oh shelly waffle little waffle circa,NO disaster
2098,slayer low mayhem festival attendance king diamond jeff passing,NO disaster
2099,tonight going mayhem everybody free st,NO disaster
2100,editor chief release issue fashion model mayhem,NO disaster
2101,new talk jarring,NO disaster
2103,collective,NO disaster
2104,coming,NO disaster
2105,momentum bite investor apple stock crash investment,NO disaster
2106,set combined two thing wrestling,NO disaster
2107,experience economic similar early mortgage show due student first,NO disaster
2108,love,NO disaster
2109,craving triple chocolate bee,NO disaster
2110,would honor meeting like,NO disaster
2111,like,NO disaster
2112,currently make seem like flight true anomaly instead,NO disaster
2113,bit also,NO disaster
2114,still waiting one trailer make rain delay come back give run,NO disaster
2116,like business,NO disaster
2117,metal price higher silver,NO disaster
2118,maybe party get drunk flirt clay,NO disaster
2119,inspector far access scientist wall street journal,NO disaster
2120,admiral say public school nationwide military via,NO disaster
2121,new hat military cap woodland,NO disaster
2122,military history revolution,NO disaster
2123,military em course,NO disaster
2124,reason love woman military,NO disaster
2125,vintage eagle oil oiler jeep military vehicle tool kit,NO disaster
2126,reason love woman military,NO disaster
2127,military,NO disaster
2128,joke military men,NO disaster
2129,husband military end seat shuffling,NO disaster
2130,military action via,NO disaster
2131,ford military nice mutt matching trailer full read,NO disaster
2132,another war without deal military,NO disaster
2133,green bayonet military combat sheath knife,NO disaster
2134,sale military rifle,NO disaster
2135,cried cake,NO disaster
2136,china aid,NO disaster
2137,one chocolate,NO disaster
2138,eat whole wet burrito,NO disaster
2139,like like rubber look oh dear,disaster
2140,oh never felt sorry someone,NO disaster
2142,loving watched,NO disaster
2143,new,NO disaster
2144,look like,NO disaster
2145,look like unreal,NO disaster
2146,lady good shout,NO disaster
2147,cover eye,NO disaster
2148,screaming natural disaster month maybe hospital,NO disaster
2149,home inventory help homeowner case natural disaster news via,NO disaster
2150,magnitude tremor rattle aftershock count recent natural disaster,NO disaster
2151,natural disaster research urgent via,NO disaster
2152,natural disaster half as rapper,NO disaster
2153,red tape tangle reconstruction disaster risk reduction natural disaster,NO disaster
2154,expert financial collapse natural disaster,disaster
2155,trust natural disaster yes regular giving pro via,NO disaster
2156,return book rand wormwood natural disaster survivor,NO disaster
2157,indeed natural,NO disaster
2158,added video natural disaster survival bacon,NO disaster
2159,another movie like impossible natural disaster focus white,NO disaster
2160,hopefully vacation include earthquake natural,NO disaster
2161,new emergency food supply natural disaster earthquake flood tornado,NO disaster
2162,help community event natural disaster,NO disaster
2163,train accident natural show failure ministry check fixed interval,NO disaster
2164,probably watched still living nuclear disaster nova,disaster
2165,chronicle yale library archive call end nuclear weapon,disaster
2166,authority japan take responsibility nuclear confidence safety nuclear plant,NO disaster
2167,digital archive public document nuclear catastrophe,NO disaster
2168,consuming energy avoid nuclear disaster,disaster
2169,third west coast child hit problem following nuclear,NO disaster
2170,nuclear disaster ongoing side,disaster
2171,former executive nuclear disaster,disaster
2172,check nuclear,NO disaster
2173,rare photograph show nightmare aftermath nuclear disaster,disaster
2174,former executive nuclear disaster,disaster
2175,watch watch nuclear welcome watch offering,NO disaster
2176,year nuclear disaster via,disaster
2177,safety nuclear regulatory committee japan already authoritarian nuclear guardian,NO disaster
2178,people tweet care japan nuclear disaster problem ignore,disaster
2179,yes shut nuclear power plant would reverse gain,disaster
2180,pact lie heart two japan go ahead,NO disaster
2181,sealed nuclear regulatory commission reactor record new wave art rock,NO disaster
2182,pact lie heart two project express,NO disaster
2183,navy sideline sub,NO disaster
2184,meanwhile nuclear project move,NO disaster
2185,nuclear reactor go ahead,NO disaster
2186,global nuclear reactor construction market grew nuclear reactor,NO disaster
2187,thorium molten salt reactor system built thorium climate nuclear,NO disaster
2188,steam pipe problem sideline breaking story,NO disaster
2189,navy sideline three submarine pending steam plant inspection,NO disaster
2190,steal nuclear fission reactor,NO disaster
2191,nuclear plant move ahead,NO disaster
2192,like memorial nuclear reactor annihilation,NO disaster
2193,nuclear reactor waste buried billion tax payer dollar,NO disaster
2194,would obliterate anyone get way sleep,NO disaster
2195,watch obliterate parenthood minority,NO disaster
2196,insanity call climate change dangerous wanting obliterate,NO disaster
2197,though certain would obliterate fighting would pretty cool,NO disaster
2198,good kind cute want,NO disaster
2199,watch local act night sweat obliterate,NO disaster
2200,seeing writer obliterate character piss bad either way,NO disaster
2201,weaponry obliterate every trace natural absolute total,NO disaster
2202,silly talk trusting terrorist nation hate vowed obliterate,NO disaster
2203,satan soul could obliterate step ash day,NO disaster
2204,ambition obliterate religion trying,NO disaster
2205,obliterate,NO disaster
2206,trump obliterate opponent quick,NO disaster
2207,love see try dis king would obliterate,NO disaster
2208,going obliterate either cavalier,NO disaster
2209,lamp need wish obliterate anyone used,NO disaster
2210,dating absolute unique course program obliterate approach anxiety get,NO disaster
2211,right thunder would obliterate,NO disaster
2212,aim completely obliterate ship,NO disaster
2213,fibula,NO disaster
2214,king constitution,NO disaster
2215,interracial sex skeeter white girl camera upon hearing,NO disaster
2216,got also ran building cry last,NO disaster
2217,toy mollusk,NO disaster
2218,mad innocent people nothing war got,NO disaster
2220,shout cent natty light can going truly,NO disaster
2221,davy play budget,NO disaster
2222,ruined day million piece spit,NO disaster
2223,feature love,NO disaster
2224,long good making amends though still,NO disaster
2225,never many conventional bomb yank japan prior city,NO disaster
2226,drunk meal cook totally,NO disaster
2227,mention,NO disaster
2228,way endurance get second would probably hell,NO disaster
2229,year hundred thousand life year pain,NO disaster
2230,day eye bomber crew survivor via,NO disaster
2231,drake absolutely meek mill,NO disaster
2232,god order obliteration ancient scholar say dire warning lie hidden ancient text,NO disaster
2233,god order obliteration ancient scholar say dire warning news,NO disaster
2234,must fear fear total,NO disaster
2235,need conquest server squad obliteration server ping,NO disaster
2236,schematization maintain fact dependable virtue,NO disaster
2237,obliteration limit,NO disaster
2238,renovation mean entrepreneur management leadership business,NO disaster
2239,must total face dune,NO disaster
2240,little death total,NO disaster
2241,god order obliteration ancient,NO disaster
2242,need overturn ruling congress mess obliteration constitution,NO disaster
2243,god order obliteration ancient,NO disaster
2244,dancing street god order obliteration ancient via,NO disaster
2245,short story indifference oppression hatred anger hope inspiration revolution retaliation,NO disaster
2246,god order obliteration ancient via,NO disaster
2247,god order obliteration ancient via,NO disaster
2248,meek mill accused drake writing drake obliteration,NO disaster
2249,amazing ancient text brown mark weigh,NO disaster
2250,many walker opponent need board infinite,NO disaster
2251,year nuclear obliteration wondering,NO disaster
2252,beautifully rapturous facade life given birth deplorable fate total,NO disaster
2253,oil spill may bigger plain,disaster
2254,oil spill may bigger,disaster
2255,breaking la oil spill may bigger,disaster
2256,national briefing spring oil spill estimate document,disaster
2257,got gas splash like oil,NO disaster
2258,oil spill anniversary,disaster
2259,spring oil spill estimate associated press via,disaster
2260,oil spill may bigger plain pipeline oil,disaster
2261,government figure plug gulf oil spill chuck plugged,disaster
2262,st wattle oil today last checked today,NO disaster
2263,oil spill may bigger,disaster
2264,spring oil spill estimate associated press via,disaster
2265,family sue legionnaire family affected fatal outbreak disease,disaster
2266,family sue family affected fatal outbreak,disaster
2267,family sue family affected fatal outbreak,disaster
2268,done stop deadly outbreak,disaster
2269,mumps outbreak university,NO disaster
2270,family sue family affected fatal outbreak,disaster
2271,family sue family affected fatal outbreak,disaster
2272,family sue family affected fatal outbreak,disaster
2273,family sue family affected fatal outbreak,disaster
2274,family affected fatal outbreak disease,disaster
2275,pandemonium aba woman baby without face,NO disaster
2276,scene bridge could win ash today pandemonium,NO disaster
2277,original lust angel self miss cause mayhem pandemonium,NO disaster
2278,time next week absolute pandemonium several home around,NO disaster
2279,pandemonium aba woman baby without,NO disaster
2280,welcome pandemonium aba woman baby,NO disaster
2281,game pandemonium pit,NO disaster
2282,pandemonium aba woman baby without face,NO disaster
2283,pandemonium aba woman baby without face,NO disaster
2284,assembly transact business due pandemonium,NO disaster
2286,move west ticket,NO disaster
2287,pandemonium aba woman baby without face according eye witness hill,NO disaster
2288,panic sublime,NO disaster
2289,may panic attack,NO disaster
2290,sound like panic,NO disaster
2291,tried panic thin soul section,NO disaster
2292,blame food panic minute,NO disaster
2293,please inform date song accurately panic week,NO disaster
2294,added video write sin tragedy,NO disaster
2295,panic attack always lovely,NO disaster
2296,panic listen buy,NO disaster
2297,confession smoked whole bowl holy panic attack,NO disaster
2298,someone hold hand tell panic attack reason,NO disaster
2299,sending check coping tip,NO disaster
2300,added video ballad mona,NO disaster
2301,molly send help form clothes,NO disaster
2302,make feel better close unprepared,NO disaster
2303,highlight,NO disaster
2304,need stop driving people behind know always stall,NO disaster
2305,people finally cable traditional trouble,NO disaster
2306,people finally cable,NO disaster
2307,business people finally cable,NO disaster
2308,deserve medal dealing basement flood without,NO disaster
2309,like crazy need,NO disaster
2310,really cause spending time could,NO disaster
2311,show last night still fact saw sweaty two eye,NO disaster
2312,worst feel fight chug two estus kill drink,NO disaster
2313,reader everyone else summer time,NO disaster
2314,day going way low key back,NO disaster
2316,people finally cable,NO disaster
2317,sure everyone enjoy without bad anxiety due bad skill shocking security,NO disaster
2318,police arrest suspect killing journalist woman,NO disaster
2319,man tried steal phone saw ye police near shouting ran two,NO disaster
2320,block st police,NO disaster
2321,shooting kill one officer police investigating shooting,disaster
2322,run census find local police track biometrics,NO disaster
2323,acting public information officer august,NO disaster
2324,theater shooting suspect news,disaster
2325,love police,NO disaster
2326,honestly understand blaming police buy,NO disaster
2327,police charge traditional ruler murder,NO disaster
2328,assist citizen agency ne ne st police,NO disaster
2329,police need stop killing people,NO disaster
2330,police gent dart watch stainless steel bracelet white dial gift box,NO disaster
2331,wired quarantine offensive content,NO disaster
2332,cod advanced warfare reckoning quarantine,NO disaster
2333,quarantine offensive content via wired,NO disaster
2334,quarantine offensive content,NO disaster
2335,tweet wired,NO disaster
2336,changelessly handle dominant quarantine folder toward,NO disaster
2337,new quarantine offensive,NO disaster
2338,quarantine offensive content,NO disaster
2339,quarantine offensive content,NO disaster
2340,enforced isolation prevent contamination could lead disease case,NO disaster
2341,quarantine offensive unveiled,NO disaster
2342,metal detector protect public place mental illness detector stop crazy quarantine,NO disaster
2343,quarantine offensive content wired tech,NO disaster
2344,quarantine offensive unveiled,NO disaster
2345,toxic community,NO disaster
2346,update content policy promise quarantine community,NO disaster
2347,man tested negative virus family member,disaster
2348,new content policy go effect many horrible,NO disaster
2349,new content policy go effect many horrible,NO disaster
2350,hot new content policy go effect many horrible best,NO disaster
2351,top new content policy go effect many horrible,NO disaster
2352,home possible,disaster
2353,certain volatile one,NO disaster
2354,home possible case,disaster
2355,new content policy go effect many horrible,NO disaster
2356,applied ban sub,NO disaster
2357,home possible,disaster
2358,saw something like last cop taking house,NO disaster
2359,top new content policy go effect many horrible,NO disaster
2360,knew world leader lifesaving emergency looking far beyond,NO disaster
2361,japan raising maximum radiation dose nuclear plant worker emergency,NO disaster
2362,jerry brown state emergency wildfire drought street gang radiation dead fish mania air pollution unemployment,disaster
2363,radiation council government admitted reform bill raise dose limit,NO disaster
2364,source,NO disaster
2365,anyone remember came tour giant rainstorm last night one stop rain,NO disaster
2366,another fun daughter get flat tire call know change worst rainstorm know,NO disaster
2367,approaching rainstorm,NO disaster
2368,severe rainstorm alp cause landslide killing three near ski resort,disaster
2369,landslide alp kill three people severe rainstorm,disaster
2371,landslide alp kill three three people severe rainstorm,disaster
2372,rainstorm way brook provincial park,NO disaster
2373,landslide alp kill three people severe rainstorm,disaster
2374,driving home fairly large rainstorm make wonder manage drive dry,NO disaster
2375,shut eye music broke like,NO disaster
2376,landslide alp kill three people severe rainstorm,disaster
2377,already thanks need go maintenance,NO disaster
2378,welcome everyday,NO disaster
2380,would hide great place wait,NO disaster
2381,home northern wildfire new york,disaster
2382,home northern associated press via,disaster
2383,home northern wildfire new york time,disaster
2384,black whipped,NO disaster
2385,home northern wildfire news,disaster
2386,yea photo,NO disaster
2387,home northern wildfire news,disaster
2388,news home northern wildfire news latest,disaster
2389,world home northern wildfire,disaster
2390,national poetry anterior room,NO disaster
2391,home northern wildfire,disaster
2392,guess got hilarious new piece thing never say mother ever,NO disaster
2393,home northern wildfire news,disaster
2394,home northern wildfire news,disaster
2395,home northern wildfire news,disaster
2396,entire aisle making people look like director whole food clothing section,NO disaster
2397,refugee read,NO disaster
2398,top spend wedding day feeding see,NO disaster
2399,powerful thought language use talk group people,NO disaster
2400,refugee,NO disaster
2401,top spend wedding day feeding see,NO disaster
2402,refugee,NO disaster
2403,integrity border human right nice trade,NO disaster
2404,newlywed feed refugee wedding,NO disaster
2405,refugee,NO disaster
2406,refugee citizen,NO disaster
2407,still wonder anything life war support cause refugee open,NO disaster
2408,refugee,NO disaster
2409,dishonest refugee gay,NO disaster
2410,bring rescue squad,NO disaster
2411,rescue kitten vent shaft fire,NO disaster
2412,time launch black mission rescue alpha,NO disaster
2413,last chance animal rescue new,NO disaster
2414,notice rescue kitty service,NO disaster
2415,official rescue migrant body found fox news,disaster
2416,grandma came,NO disaster
2417,open rescue pocket knife new blue,NO disaster
2418,beauty deal lot color scissors princess care rescue,NO disaster
2419,picture worth thousand word would one passion,NO disaster
2420,medium recently went support rescue,NO disaster
2421,want either bot,NO disaster
2422,sister alone end beautiful sad,NO disaster
2423,worker top central street water tower,NO disaster
2424,baby girl half mile,disaster
2426,ground zero cant come soon enough,NO disaster
2427,bought new property year intention providing sanctuary farm,NO disaster
2428,three suspect police net old baby aba baby,NO disaster
2429,trekker amid flash flood news,disaster
2430,migrant boat tragedy survivor arrive migrant,disaster
2431,lady police tribune,NO disaster
2432,two people passenger boat two dozen passenger,NO disaster
2433,prosecutor drop charge kim two puppy via change,NO disaster
2434,amid flood,disaster
2435,piglet running national speed limit road,NO disaster
2436,rescuer recover body man lake near,disaster
2437,hundred migrant boat rescuer saved people though,disaster
2438,body rescuer searching hundred migrant,disaster
2439,rescuer searching hundred migrant mediterranean boat carrying many,disaster
2440,bay whale worry rescuer,NO disaster
2441,rescuer rescuer,NO disaster
2442,fear missing migrant rescuer search survivor boat carrying many,disaster
2443,body rescuer searching hundred migrant mediterranean boat,disaster
2444,body rescuer searching hundred migrant,disaster
2445,guide rescuer injured county,disaster
2446,body rescuer searching hundred migrant,disaster
2447,news break rescuer search survivor boat carrying many migrant,disaster
2448,rescuer heroically help beached garbage back,NO disaster
2449,rescuer found,NO disaster
2450,body rescuer searching hundred migrant,disaster
2451,chold ironically call stadium riot,NO disaster
2452,bateman score,NO disaster
2453,hey check secret get riot point check profile,NO disaster
2454,discovered riot,NO disaster
2455,broad take eight joe root run riot broad took figure,NO disaster
2456,discovered riot,NO disaster
2457,feminist world,NO disaster
2458,feminist world riot grill,NO disaster
2459,feminist world riot grill,NO disaster
2460,ill pax,NO disaster
2461,broad take eight joe root run riot,NO disaster
2462,role play park,NO disaster
2463,feminist world riot grill pop,NO disaster
2464,dig controversial trailer real hero riot video gay,NO disaster
2465,riot police intervene supporter fan clash buildup second,NO disaster
2466,riot police intervene supporter fan clash buildup,NO disaster
2467,video ghee still see rioting walk,NO disaster
2468,watch run jewel use fact defend rioting socially minded duo take,NO disaster
2469,swear god make faker play rioting,NO disaster
2470,watch run jewel use fact defend rioting socially minded duo take,NO disaster
