,text,result
1015,residential commercial builder,NO disaster
1016,dude,NO disaster
1017,fix charger,NO disaster
1018,ball,NO disaster
1019,finally spring property sat vacant,NO disaster
1020,hate seeing boy get like,NO disaster
1021,try eat healthy seriously like arm move know entire,NO disaster
1022,house set saved demolition charity,NO disaster
1023,draw day daily football selection service,NO disaster
1024,demolition flooding,NO disaster
1025,cemetery demolition cultural group,NO disaster
1026,show auto part celebrity demolition thanks celebrity great,NO disaster
1027,apartment marked demolition,NO disaster
1028,general news house waterway begin mile via full story,NO disaster
1029,billy house final show new,NO disaster
1030,demolition mean flint michigan fate metropolis,NO disaster
1031,house live affordable housing,NO disaster
1032,tag team awesome song scary looking,NO disaster
1033,problem motel demolition,NO disaster
1034,demolition done away throwing flesh sin,NO disaster
1035,house live affordable housing,NO disaster
1036,demolition underway stadium stay throughout,NO disaster
1037,pray attack enemy derail ur destiny blocked lord flood ur life blessing,NO disaster
1038,pray attack enemy derail ur destiny blocked lord flood ur life blessing,NO disaster
1039,two train derail central,disaster
1040,everyone start project best intention common pitfall happen along let,NO disaster
1041,news rail train derail flash flood,disaster
1042,pray attack enemy derail ur destiny blocked lord flood ur life blessing,NO disaster
1043,related train derail downtown local post,disaster
1044,derail real hell damn,NO disaster
1045,try summer treat derail diabetes meal,NO disaster
1046,pray attack enemy derail ur destiny blocked lord flood ur life blessing,NO disaster
1047,eruption questionable financial dealing derail campaign via,NO disaster
1048,premature interest rate increase could derail interest rate,NO disaster
1049,course effort address beyond would derail obvious,NO disaster
1050,people even ride,NO disaster
1051,derail real hell damn,NO disaster
1052,train passenger red line train disabled,NO disaster
1053,former assembly candidate still waiting answer,NO disaster
1054,interesting train morn going one line affected closure,NO disaster
1055,know path make coming yard turning,NO disaster
1056,train sidewalk outside get bus,NO disaster
1057,passenger train morning,disaster
1058,see photo old lady fall say power line diamond mine,NO disaster
1059,may right going keep holding remain,NO disaster
1060,also estimate damage yet train shuttle service,NO disaster
1061,oh train kind disappointed unsurprised,NO disaster
1062,car train ready go service near station noon,NO disaster
1063,rare lizard plan build huge coal mine,NO disaster
1064,news twin train derailment leaf least dead time world,disaster
1065,photo green line derailment,disaster
1066,train village youth saved many group villager saved life two,disaster
1067,green passenger due derailment however service,NO disaster
1068,great photo green line derailment one hurt,disaster
1069,latest prabhu call derailment natural official feel economic,disaster
1070,green line service derailment near expect,disaster
1071,green line train resume service south side green line service four,disaster
1072,train village youth saved many group villager saved life two,disaster
1073,rail disaster,NO disaster
1074,train village youth saved many life,disaster
1075,twitter said bet twitter broke desolate careful,NO disaster
1076,house left,NO disaster
1077,sank night submarine light sat stale beer afternoon desolate,NO disaster
1078,heaven utterly say people two,NO disaster
1079,desolate part love via,NO disaster
1080,become desolate enough never,NO disaster
1081,shaping multimillion chop local billet frugal else companionate anacrusis production desolate,NO disaster
1082,may peculiar compliment would incapable research desolate music,NO disaster
1083,really sad white people quick give money desolate uneducated black educated black productive,disaster
1084,desolate idea ever get,NO disaster
1085,desolate part via,NO disaster
1086,horn saw beast hate make desolate naked eat flesh burn fire,NO disaster
1087,follow go brutally lovely mum,NO disaster
1088,searching desolate part beach cell service mile away,NO disaster
1089,feeling take,NO disaster
1090,recall blighted desolate corporate,NO disaster
1091,desolation wilderness kodak graph,NO disaster
1092,desolation,NO disaster
1093,video desolation beacon blast bombardment,NO disaster
1094,abomination,NO disaster
1095,free kindle book thriller desolation run,NO disaster
1096,desolation set digital,NO disaster
1097,want free desolation despair,NO disaster
1098,desolation,NO disaster
1099,watching desolation always love catching caught beginning,NO disaster
1100,going school amidst desolation earthquake aftermath love,NO disaster
1101,hey girl must part desolation seeing,NO disaster
1102,lamb god desolation,NO disaster
1103,see desolation via,NO disaster
1104,emotional desolation effect family forgiving hard,NO disaster
1105,debate robot become self destroy thus thrusting world life,NO disaster
1106,wrong last night today destroy,NO disaster
1107,overall lad well need pile get run ahead,NO disaster
1108,jake swear god one god damn piece algae pond going destroy little,NO disaster
1109,people destroy unless let,NO disaster
1110,something bad either let define destroy let strengthen,NO disaster
1111,plan destroy public education cut teacher pay even make buy school pure evil,NO disaster
1112,bad people kiss kiss,NO disaster
1113,destroy,NO disaster
1114,skate destroy em de skate,NO disaster
1115,people fear try say anything destroy,NO disaster
1116,real glass seven always villain want destroy,NO disaster
1117,cast destroy set across,NO disaster
1118,medium stock getting via,NO disaster
1119,see may may help help government,NO disaster
1120,two people dead house two people reportedly,disaster
1121,black eye space battle star fleet ship,NO disaster
1122,carp erased pretty sure,NO disaster
1123,poor need stuck kiki twice,NO disaster
1124,house farm produce flood house,NO disaster
1125,bit repentance life continue abuse,NO disaster
1126,cricket plan exercise,NO disaster
1127,black eye space battle star fleet ship,NO disaster
1128,two people dead house,disaster
1129,remember nuclear occurrence never ever happen yet highly likely recur,NO disaster
1130,travel open get two week lesson learned,NO disaster
1131,thought glad,NO disaster
1132,home zero join sign,NO disaster
1133,dude enormous blizzard,NO disaster
1134,ally republican party war clarion,NO disaster
1135,evil,NO disaster
1136,warcraft weapon,NO disaster
1137,world legion revealed burning legion return bring destruction,NO disaster
1138,written play destruction lady franklin mull,NO disaster
1139,need motorway fume present extra noise,NO disaster
1140,new ran report human right abuse forest destruction,NO disaster
1141,put tail slip,NO disaster
1142,hand destruction innocent young,NO disaster
1143,crackdown destruction restricted crackdown week,NO disaster
1144,authority take account petition destruction,NO disaster
1145,life cheap evil profit,NO disaster
1146,day death destruction people please take sometime remember think,NO disaster
1147,one three survivor destruction,NO disaster
1148,let stand evidence horrible destruction potentially wrought noble,NO disaster
1149,new ran report human right abuse forest destruction,NO disaster
1150,related bureaucrat singled destruction global atlantic,NO disaster
1151,crackdown destruction restricted crackdown definitely,NO disaster
1152,start car use detonate evil,NO disaster
1153,track brown detonate,NO disaster
1155,brown detonate,NO disaster
1156,brown detonate producer brown present upcoming album grandeur,NO disaster
1157,best moment daily show,NO disaster
1158,another detonate killer,NO disaster
1159,detonate brown,NO disaster
1160,tried detonate uninhabited worse,NO disaster
1161,listen brown detonate music group,NO disaster
1162,detonate determine hoax feel comfortable opening,NO disaster
1163,track brown detonate,NO disaster
1164,brown detonate producer brown present,NO disaster
1165,first grenade thought one apparently bomb squad plan detonate around,disaster
1166,ignition knock fit,NO disaster
1167,detonation fashionable electronic watch couple leisure,NO disaster
1168,open detonation indicator irretrievable fashion financial,NO disaster
1169,ignition knock sensor,NO disaster
1171,ignition knock,NO disaster
1172,detonation fashionable electronic watch couple leisure,NO disaster
1173,detonation fashionable electronic watch couple leisure,NO disaster
1174,detonation fashionable electronic watch couple leisure,NO disaster
1175,ignition knock fit legacy,NO disaster
1176,ignition knock,NO disaster
1177,detonation land mine height,NO disaster
1178,ignition knock sensor original equipment,NO disaster
1179,via detonation land mine,NO disaster
1180,ignition knock standard,NO disaster
1181,ignition knock sensor,NO disaster
1182,link let pick city bomb size altitude,NO disaster
1183,detonation land mine height,NO disaster
1184,disaster,NO disaster
1185,literally right,NO disaster
1187,absolutely,NO disaster
1188,said,NO disaster
1189,disaster sign disaster declaration northern,disaster
1190,thanks yes definitely something affect men husband,NO disaster
1191,disaster sign disaster declaration northern,disaster
1192,cant believe ross character top acting,NO disaster
1193,super yesterday felt like play,NO disaster
1194,actually see lady perform begin live person,NO disaster
1195,disaster sign disaster declaration northern,disaster
1196,cook fresh sauce manage spill sink,NO disaster
1197,channel got worried,NO disaster
1198,longer best character much give going,NO disaster
1199,mommy,NO disaster
1200,already missing,NO disaster
1201,absolutely ross,NO disaster
1202,girl actually meeting boy,NO disaster
1203,director first cannot begin tell devastation,NO disaster
1204,soccer wild swimming child teen hookup case nuclear devastation shower miss,NO disaster
1205,felt grief bordering devastation losing connection god church,NO disaster
1206,father devastation day refuse speak day,NO disaster
1207,despite past devastation fortunately forgiveness mutual respect peace remember,NO disaster
1208,midst devastation something within always point way,NO disaster
1209,sad reminder nuclear devastation post,NO disaster
1210,devastation part,NO disaster
1211,devastation atom making mandatory film human suffering shown,NO disaster
1212,country next one week ago economic devastation,NO disaster
1213,profile legacy cultural devastation attempt white house,NO disaster
1214,least house bridge flash flood,disaster
1215,year atomic bomb japan still struggle war anniversary devastation wrought,disaster
1216,year atomic bomb japan still struggle wartime anniversary devastation,disaster
1217,red tape tangle reconstruction disaster risk reduction natural disaster,NO disaster
1218,one feel like much responsibility one anything disaster,NO disaster
1219,trying route sister lafayette indy west hope,NO disaster
1220,time end disaster rail,NO disaster
1221,see politician leading disaster,NO disaster
1222,paladin going disaster,NO disaster
1223,acquisition even bigger disaster ever,NO disaster
1224,overpopulation woman incapable keeping leg together save world endless brat want run disaster,NO disaster
1225,harper get calling government via,NO disaster
1226,disaster secret,NO disaster
1227,disaster,NO disaster
1228,deepwater drill company gain transocean one company associated deepwater horizon oil well disaster,NO disaster
1229,acquisition even bigger disaster ever,NO disaster
1230,electric debut disaster looking forward see adjustment make start,NO disaster
1231,family lucky hundred feared dead latest boat disaster,NO disaster
1232,heat wave misery via,disaster
1233,strategy internally,disaster
1234,strategy internally,disaster
1235,next charity program people tech boom based tinder,NO disaster
1236,thousand monsoon rain ten thousand people,disaster
1237,angry woman openly nema stealing relief material meant angry internally,NO disaster
1238,viking took island noble house got welcome new,NO disaster
1239,job event target double employee,NO disaster
1240,crazy far advance feel air subway car train show,NO disaster
1241,point return prison like condition genocide refugee,disaster
1243,local family fire via let help family please,NO disaster
1244,strategy internally,disaster
1245,try eating like fat as much would cost fat,NO disaster
1246,record hurricane drought,disaster
1247,drought report list se,NO disaster
1248,best perennial,NO disaster
1249,el monte attempt shed reputation delinquency drought star,NO disaster
1250,also take gal water produce drought chaos,NO disaster
1251,thought drought,disaster
1252,record hurricane drought,disaster
1253,new drought monitor showing drought spread,NO disaster
1254,thought,NO disaster
1255,use much water drought,NO disaster
1256,water conservation north government level drought level north,NO disaster
1257,record hurricane drought anticipate,disaster
1258,drought giant marketing campaign star war turn,NO disaster
1259,record hurricane drought via,disaster
1260,swear there bud drought,NO disaster
1261,incredibly sad heartbroken going drown sorrow food watch night,NO disaster
1262,bout get shower drown,NO disaster
1263,cant breathe feel throat want die let drown tear please,NO disaster
1264,need drown ice,NO disaster
1265,made drown,NO disaster
1266,id drown,NO disaster
1267,yes probably drown craft throughout year mean spoiled,NO disaster
1268,throw deep end watch drown,NO disaster
1269,drown leftover chili wishing,NO disaster
1270,let drown water wall mall make smile,NO disaster
1271,drown,NO disaster
1272,genuinely like someone like hold back else drown affection attention,NO disaster
1273,around drown,NO disaster
1274,absolute drown steak pile moist grape jam,NO disaster
1275,drown make heart beat like,NO disaster
1276,legit drown,NO disaster
1277,yeah definitely go drown pool damn hot inside,NO disaster
1278,fall drown think,NO disaster
1279,hundred feared migrant boat hundred migrant feared,disaster
1280,migrant feared squeeze onto boat,NO disaster
1281,hundred feared migrant boat hundred migrant feared,disaster
1282,hundred migrant feared news waar,NO disaster
1283,getting yet still search,NO disaster
1284,hundred feared migrant boat,disaster
1285,rain,NO disaster
1286,jeff sally ben hoodie abandoned sacrifice lost,NO disaster
1287,tried nowhere near thought based ketchup wasnt bad,NO disaster
1288,hundred feared migrant boat hundred migrant feared,disaster
1289,pretty sure almost time pool today thanks,NO disaster
1290,almost sea,NO disaster
1291,hard time everything literally,NO disaster
1292,boy save autistic brother dove pool save autistic,NO disaster
1293,family toddler rare hundred,NO disaster
1294,told would lend,NO disaster
1295,desperate like mouse septic,NO disaster
1296,one know know survive,disaster
1297,experience actual,NO disaster
1298,girl centipede press limited full,NO disaster
1299,girl centipede press limited full,NO disaster
1300,seen,NO disaster
1301,boy save autistic brother dove pool save autistic brother,NO disaster
1302,boy save autistic brother dove pool save autistic brother,NO disaster
1303,girl centipede press limited full,NO disaster
1304,migrant erecting monument year shed tear powerful greed die,NO disaster
1305,sound half bad,NO disaster
1306,boy save autistic brother,NO disaster
1307,oh storm attack bullet thing made crazy ricochet attack,NO disaster
1308,dust storm chase scene pretty damn,disaster
1309,new mad show lovely dust storm,NO disaster
1310,recent project storm,NO disaster
1311,dust storm rolling onto base august,disaster
1312,new mad show lovely dust storm combat magnum new mad,NO disaster
1313,seen new movie trailer dust,NO disaster
1314,new still dust storm,disaster
1315,headline storm mar money,NO disaster
1316,dust storm sadly tonight look forward,disaster
1317,disappear dust storm atmospheric thriller,disaster
1318,storm last forever dust must settle truth,NO disaster
1319,dust storm,disaster
1320,dust storm morocco strait,disaster
1321,volcano earthquake,disaster
1322,earthquake,NO disaster
1323,imagine earthquake,NO disaster
1324,child earthquake educated coping,NO disaster
1325,manuscript suspiciously earthquake science journal could rock world,NO disaster
1326,sister new video coming apocalyptic earthquake tsunami,disaster
1327,earthquake south user earthquake information,disaster
1328,anchorage,NO disaster
1329,magnitude ca,NO disaster
1330,magnitude anchorage ak,NO disaster
1332,electrocute,NO disaster
1333,already met special someone even know,NO disaster
1334,wish electrocute time second,NO disaster
1335,wish could buy device would electrocute every time went eat something much,NO disaster
1336,let electrocute,NO disaster
1337,stay,NO disaster
1338,electrocute as thank,NO disaster
1339,feel like would actually electrocute tried,NO disaster
1340,drinking afraid might spill headphone electrocute,NO disaster
1341,phone power electrocute bath,NO disaster
1342,morning late crazy guy tell people door electrocute,NO disaster
1343,broke trying electrocute die,NO disaster
1344,eh thanksgiving parade still electrocute,NO disaster
1345,remember suddenly electrocute death fox,NO disaster
1346,loose understanding sub ah electrocute eat want influence,NO disaster
1347,robot electrocute,NO disaster
1348,electricity wire golf ball hooked catch bolt lightning electrocute brother,NO disaster
1349,let electrocute,NO disaster
1350,electrical tape wrapped around charger like month want get,NO disaster
1351,almost,NO disaster
1352,south side factory worker pay penalty,NO disaster
1353,realize could last night,NO disaster
1354,fish whale whale thing fish get,NO disaster
1355,south side factory worker pay penalty news,NO disaster
1356,brother got plug socket,NO disaster
1357,got mosquito,NO disaster
1358,simply let plugging phone work,NO disaster
1359,would get,NO disaster
1360,dont use earphone phone might especially ear,NO disaster
1361,short hair never look cute look like vagrant,NO disaster
1362,get,NO disaster
1363,please fix problem zombie disable suit floor die auto magically,NO disaster
1364,hope get today work,NO disaster
1365,oh certainly would live,NO disaster
1366,emergency garage gate service entrance agent set,NO disaster
1367,motor hot deal manual transmission shift hand brake handle,NO disaster
1368,seed vegetable fruit variety garden kit emergency survival gear full,NO disaster
1369,emergency need part,NO disaster
1370,matter dilemma emergency righteousness shall,NO disaster
1371,seed vegetable fruit variety garden kit emergency survival gear full,NO disaster
1372,survival kit whistle fire starter wire saw cree torch emergency blanket knife full,NO disaster
1373,registered nurse er emergency room supplemental health nursing job job,NO disaster
1374,job case,NO disaster
1375,hey said tell dad call,NO disaster
1376,leaving back one single thing emergency,NO disaster
1377,emergency hop,NO disaster
1378,safe prepare emergency kit alertness woman child also,NO disaster
1379,municipal emergency plan crisis,disaster
1380,take another beating summer city emergency plan,disaster
1381,sri past need plan emergency,NO disaster
1382,take another beating summer city emergency another day watching,NO disaster
1383,spoke get funded emergency drought act plan story,NO disaster
1384,new post plan help employee get back productive work,NO disaster
1385,plan help employee get back productive work,NO disaster
1386,picture jeff wonder emergency plan,disaster
1387,emergency drinking water guide,NO disaster
1388,video hunting optic emergency exit,NO disaster
1389,take another beating summer city emergency plan,disaster
1390,take another beating summer city emergency plan,disaster
1391,take another beating summer city emergency,NO disaster
1392,storm prompt activation city municipal emergency city remains,disaster
1393,emergency room refuse service payment,NO disaster
1394,call emergency service trained horse rescue,NO disaster
1395,nursing job might great fit nurse shift manager emergency service full,NO disaster
1396,emergency service following shark sighting,NO disaster
1397,call emergency service trained horse rescue,NO disaster
1398,week protest service delivery lack emergency service,NO disaster
1399,human resource process streamlined insofar emergency service,NO disaster
1400,genius double pay emergency service military teacher tube driver,NO disaster
1401,finger cut immediate reaction emergency service,NO disaster
1402,say call dad phone dial emergency,NO disaster
1403,emergency plumber emergency plumbing plumber,NO disaster
1404,emergency service first responder work together slander try get,NO disaster
1405,click registered nurse emergency department fellowship nursing,NO disaster
1406,get emergency locksmith service canada business got locked locksmith,NO disaster
1407,providence health registered nurse emergency department nursing,NO disaster
1408,recommend anyone nursing ca,NO disaster
1409,click staff registered nurse emergency service job wa,NO disaster
1410,experienced emergency rescue,NO disaster
1411,cake,NO disaster
1412,low take,NO disaster
1413,become forget ever,NO disaster
1414,came land tribal war turned land peace,NO disaster
1415,tube strike latest travel update chaos,disaster
1416,feel low take,NO disaster
1417,feel low take,NO disaster
1418,feel take,NO disaster
1419,projectile cloud smoke moment later shadow,NO disaster
1420,society become every moment take fun moment,NO disaster
1421,close eye picture world would like bot,NO disaster
1422,men escape car flame canyon crew investigating cause,disaster
1423,latest travel update chaos telegraph,disaster
1424,low take,NO disaster
1425,live wild wing,NO disaster
1426,guy next walk tiny office room smelling lunch evacuate,NO disaster
1427,rather as least know whatever eat heartburn stick,NO disaster
1428,know ur,NO disaster
1429,troop battle ground since deal turkey evacuate buffer zone area hence moving front,NO disaster
1430,fire get worse evacuate aka school tomorrow,NO disaster
1431,dog evacuate room disgusting as broom as,NO disaster
1432,father north tower trying evacuate people,NO disaster
1434,evacuate oak regal never,NO disaster
1435,town ordered evacuate fire,NO disaster
1436,everywhere else except like shop like panda come,NO disaster
1437,order wa,NO disaster
1438,chemical spill water plant water supply plant official,disaster
1439,house bank tree strong wind,NO disaster
1440,chesterfield apartment complex fire,NO disaster
1441,gold coast tram due broken local,disaster
1442,many fire fight air tanker pilot support crew,NO disaster
1443,unit resident fire broke morning,NO disaster
1444,family weather bomb,NO disaster
1445,grass fire burn past prompt evacuation fire,NO disaster
1446,green line train south side passenger safely say,disaster
1447,secret bunker used look like staff,NO disaster
1448,valley building fire,NO disaster
1449,fight flame save oak wildfire,NO disaster
1450,string concealment straight evacuation,NO disaster
1451,school dumb set evacuation siren accident,NO disaster
1452,anatomic mother help high evacuation,NO disaster
1453,order evacuation abandoned aircraft news,disaster
1454,even tho getting back due evacuation could make missing,NO disaster
1455,neediness taste evacuation,NO disaster
1456,know hurricane evacuation find,NO disaster
1457,would designed building occupant evacuate report evacuation assembly site,NO disaster
1458,evacuation drill fire door open got smash emergency release glass,NO disaster
1459,jeff king report level evacuation east county line hale,NO disaster
1460,ca mad river evacuation advisory ridge area,disaster
1461,prepared crucial home evacuation find,NO disaster
1462,medical care facility near nuclear plant lack evacuation plan,NO disaster
1463,evacuation order town time,disaster
1464,throw wintergreen ground would explode enemy give mouth cancer,NO disaster
1465,damn head feel like gone explode,NO disaster
1466,happy make heart explode,NO disaster
1467,say alliance,NO disaster
1468,ear explode,NO disaster
1469,guy explode,NO disaster
1470,actually heart beat fast fly chest explode,NO disaster
1471,influence simple strategy explode page create,NO disaster
1472,full stomach going explode,NO disaster
1473,need follow explode,NO disaster
1474,feel like going explode wonder begin within,NO disaster
1475,twitter match,NO disaster
1476,fact machine must exploded today following,NO disaster
1477,aphid population exploded last,NO disaster
1478,similar thing carpenter one girl threw dog,NO disaster
1479,bleach skin touching boudoir eyeball bleeding brain,NO disaster
1480,holy hell bathroom car smell like,NO disaster
1481,exploded brought universe match heaven,NO disaster
1482,electricity exploded trying fix,NO disaster
1483,even know pen still exploded like everywhere,NO disaster
1484,news science warship exploded sailor artillery dive,NO disaster
1485,moment year ago atomic bomb exploded instantly killing least,disaster
1486,take advantage smith deal right exploded car hint,NO disaster
1487,tap bath exploded look like someone love great plumbing,NO disaster
1488,twitter would exploded,NO disaster
1489,exploded brought universe match heaven,NO disaster
1490,oh wow head exploded mess crap everywhere,NO disaster
1491,engine exploded trying find solution,NO disaster
1492,hobby lobby exploded,NO disaster
1493,lump together warehouse information explosion one divestment,NO disaster
1494,explosion one morgan,NO disaster
1495,new tempered glass screen protector film blackberry full read,NO disaster
1496,new tempered glass screen protector film blackberry full read,NO disaster
1497,whole explosion thing comment first time,NO disaster
