,keyword,location,text,labels
1865,crush,dc native,giving music teacher look student crush girl went high school,0
1866,crush,,seriously biggest girl crush ever blake lively,0
1867,crush,,see crush,0
1868,crush,everywhere,secret,0
1869,crush,fl,yeah crush,0
1870,crush,,trying look cute wen crush passing,0
1871,crush,utah,crush content,0
1872,crush,,crush one girl high school even realize,0
1874,crush,,men crush every,0
1876,crush,nykae,crush,0
1877,crush,honeymoon avenue,well know one crush one,0
1878,crush,worldwide,tantrum league crush listen,0
1879,crush,,man crush everyday,0
1880,crush,,love love playa crush lot,0
1881,crush,,crush da,0
1882,crushed,,crushed,0
1883,crushed,,bout get crushed,0
1884,crushed,,crushed holy,0
1885,crushed,wherever netflix,crushed soul,0
1886,crushed,,crushed,0
1887,crushed,,cable share crushed,0
1888,crushed,il,crushed squirrel bone mortar pestle really sure,0
1890,crushed,,mango juice crushed,0
1891,crushed,,man crushed death car,1
1892,crushed,ph,diamond piece charcoal handled stress exceptionally hard every side,1
1893,crushed,,crushed,0
1894,crushed,,crushed gym crushed flurry clearly priority straight,0
1895,crushed,online,cable share crushed,0
1896,crushed,,question would crush bunting sport writing forefather crushed,0
1897,crushed,tx,ouch could almost hear hope dream crushed,0
1898,crushed,,ball,0
1899,crushed,guayaquil,crushed run pace,0
1900,crushed,reeko,absolutely crushed ball,0
1901,crushed,buck pa,crushed mile run awesome,0
1902,crushed,sunny south florida,cable share crushed,0
1903,crushed,rio,oil price falling driver could reap benefit,0
1904,crushed,neverland,crushed run pace,0
1905,crushed,pennsylvania,nick hit another crushed,0
1906,crushed,,holy moly,1
1907,crushed,,play brasswork agency crushed shaken radio listen,0
1908,crushed,,many saying would get crushed came underestimate,1
1909,crushed,trinidad tobago,lead character go lucky free spirit life trope intact,0
1910,crushed,chicago lake buena vista,remember crushed two week,0
1911,crushed,ontario,empire avenue crushed soul via,0
1912,crushed,liberty wa,hermitage much purple violet slate crushed gravel white wine,0
1913,curfew,,thirst curfew,0
1914,curfew,ankara malatya ad orontem,ara news fighter district aim carrying suicide curfew,1
1915,curfew,,thirst curfew,0
1916,curfew,,fact curfew,0
1917,curfew,california,shut freshman past ur need spend much ur time watching instead going outside,0
1918,curfew,state pa,night curfew,0
1919,curfew,il,curfew violation riding stolen two taken news,1
1920,curfew,,reason listening curfew overtime stuck kodak,0
1921,curfew,somewhere cali,gave curfew,0
1922,curfew,im around jersey,curfew really help think,0
1923,curfew,garden grove,boxer brief curfew large,0
1924,curfew,australia,curfew,0
1925,curfew,,thank city wide,0
1926,curfew,,said curfew,0
1927,curfew,,curfew start right private class tutor must woman preferably someone,0
1929,curfew,,past grove,0
1930,curfew,usa,said everyone go home,1
1931,curfew,aztec princess,said get curfew time,0
1932,curfew,turner fenton,ball curfew,0
1933,curfew,,seen turn blind eye bloke drinking smoking curfew time worth,1
1934,curfew,,next may school obligation like best damn,1
1935,curfew,uganda,know saying final grandpa seen news rip always open idea may curfew,0
1936,curfew,,people really still curfew even graduated high school,0
1937,curfew,,telling past curfew,0
1938,curfew,,cancel cat doctor appointment decided go play come home curfew,0
1939,curfew,australia,curfew,0
1940,curfew,california,lie pay like first get car freedom,0
1941,curfew,australia,curfew,0
1942,curfew,pon di gully,rite man curfew long side aka cum fi steal di show rubbery di whole fi sound,0
1943,curfew,benedict college,dont even come worried curfew,0
1944,curfew,htx,got whole curfew,0
1945,curfew,,hour late curfew pray dog bark unlocking door,0
1946,curfew,im lost,da judge gave dis girl curfew,0
1947,curfew,miami,beginning summer made curfew back never go wonder always home,0
1948,curfew,,lim start curfew,0
1949,curfew,,bombed try get home curfew,0
1950,cyclone,united kingdom,baby walter cyclone,0
1951,cyclone,de iowa,big ten annual football medium day get cyclone hoop recruiting,1
1952,cyclone,usa,camera art photography new dual outlet power external camera,0
1953,cyclone,rural northern nevada,work large cyclone would,0
1954,cyclone,republic philippine,new tropical cyclone forming near formed,1
1955,cyclone,,new de cyclone tribune new de,0
1956,cyclone,,need plant pacific cyclone season would help,1
1957,cyclone,,forced retract false claim cyclone pam via,1
1958,cyclone,,great condition cyclone softball bat,1
1959,cyclone,philippine,severe weather bulletin typhoon,1
1960,cyclone,dc,cyclone power calm vincent,1
1961,cyclone,hyderabad,ante cyclone ne ante,1
1962,cyclone,vancouver worldwide,cyclone family need help,1
1963,cyclone,quezon philippine,severe weather bulletin cyclone typhoon,1
1964,cyclone,geneva,back future cyclone pam traditional way,1
1965,cyclone,connecticut,bank manager loan given purchase,0
1966,cyclone,sioux sd,excited cyclone football,0
1967,cyclone,cornwall,forced retract false claim cyclone pam via,1
1968,cyclone,beside basketball,misdirection cyclone ignite vanishing drive phantom shot,1
1969,cyclone,italy,radio station program address upcoming cyclone,1
1970,cyclone,tafekop,like cyclone imperialism spin across militarism crush people suck blood like,1
1971,cyclone,,cyclone hood nice core cobra jet,0
1972,cyclone,,cyclone passion,0
1973,cyclone,,majesty emperor unstoppable cyclone entertainment history everywhere,0
1974,cyclone,,cyclone quarter panel rear trim cobra jet,1
1975,cyclone,,cyclone maximum wind maximum wind gust,1
1976,cyclone,melbourne,may ask read fate,0
1977,cyclone,vilnius,drug alcohol,0
1978,cyclone,geneva,blending old new prepare future,0
1979,cyclone,,food flood victim tropical cyclone united,1
1980,cyclone,,house hamlet region severely cyclone,1
1981,cyclone,made america,cyclone double would cherry top,0
1982,damage,stop asking,probably allow ascend get damage value,0
1983,damage,,drop damage,0
1984,damage,allover,union say supportive yet prepared damage last,0
1985,damage,usa,video collateral,0
1986,damage,bartholomew indiana,property limestone,1
1987,damage,,fitness knee damage solution,0
1988,damage,mind world,phoenix mode fire turn ray option take,0
1989,damage,,wha damage,0
1990,damage,catskills,accident property damage,1
1991,damage,,crazy phone much damage person,0
1992,damage,sc,got pretty windy,0
1993,damage,,advanced life equipment transit drumming champaign,0
1994,damage,right,carful spotting damage time check time giving away loss wy,0
1995,damage,texas,storm damage west,1
1996,damage,via,hey royal love damage,1
1997,damage,,keep deal weapon damage,1
1998,damage,indonesia,fairy specialize property,0
1999,damage,unknown,yeah fast extremely high damage want fast get,1
2000,damage,unknown,saw fast great damage used exclusively whole,0
2001,damage,mi,say tree fall know homeowner insurance may,0
2002,damage,new connecticut,tor tor situation wind damage enhanced wording key,1
2003,damage,,happening hear runway lighting damage,1
2004,damage,austin san diego,written damage ability offer service future want work anyway,0
2005,damage,,trillion cross line time attack instant kill damage,1
2006,damage,galicia,damage,0
2007,damage,somewhere canada,nine inmate causing damage remand riot,1
2008,damage,york,powerful cleric say militia must wont forget damage done ur,1
2009,damage,avenue new ny,homeowner insurance cover water good thing,1
2010,damage,,beach damage,1
2011,damage,,cross arm cover hand,0
2012,damage,,new post cam pussy as boob nude,0
2013,damage,charlotte nc,hit damage,1
2014,damage,,devil may cry special edition agnus mission damage,0
2015,damage,maryland,glaucoma fluid build pressure inside eye level may damage optic nerve,1
2016,damage,,storm damage thunderstorm damage report,1
2017,damage,,puncture wound without foreign body left index finger without damage nail initial encounter,1
2018,damage,australia,thank word warning via,0
2019,damage,conversation,real damage bitch,0
2020,damage,usaov,damage,0
2021,damage,madhya,standard damage control,1
2022,damage,tennessee,said superficial wound pepper spray,1
2023,danger,,chase constantly time great deal danger distraction,0
2024,danger,lemongang,believe shirt company every animal ever better start seeing change,0
2025,danger,ayr,danger union bear,0
2026,danger,,open falling danger release day blast review,1
2027,danger,worldwide,check preview danger zone coming,0
2028,danger,san california,red flag warning fire danger dry thunderstorm bay area weather,1
2029,danger,worldwide,check preview danger zone coming,0
2030,danger,england,like could danger something,1
2031,danger,killarney,last tree cut last fish eaten last stream realize,0
2032,danger,ny,take preservation park imposition danger never,0
2033,danger,lahar gwalior,medium take serious concern danger,1
2034,danger,st mn,training grain wheat bare gold august heat anger trespass lest seek,0
2035,danger,atlanta georgia,oppression danger coming soon album,0
2036,danger,,lost ethical moral mean whole population danger,0
2037,danger,il,like head first especially home danger,0
2038,danger,world,permit bear hunting danger actual license st,0
2039,danger,spinning,much danger,0
2040,danger,atlanta georgia,oppression danger coming soon album,1
2041,danger,,looking repair recent bad rap nonprofit,0
2042,danger,hailing dayton,wish could get secret good,0
2043,danger,worldwide,check preview danger zone coming,0
2044,danger,newcastle upon england,would arsenal fan want west ham relegation battle danger sun,0
2045,danger,atlanta georgia,oppression danger coming soon album,0
2046,danger,atlanta georgia,nugget oppression danger coming soon album,0
2047,danger,,danger excitement underwater cave diving,0
2048,danger,,girl save like danger health try somebody somebody,0
2049,danger,,gun really used unless life danger,0
2050,danger,always dying never resting,thirsty danger dehydration,1
2051,danger,san ca,thunderstorm little rain central high fire weather,1
2052,danger,,get danger day tattoo bad cool would spider look like someone wrist,0
2053,danger,israel,experience always angry critical pundit grave danger going,0
2054,danger,uruguay westeros gallifrey,danger,0
2055,danger,kansa mo,dangerous rest,0
2056,danger,silver md,investigate respond complaint since left danger,0
2057,danger,jersey,honestly tho stealing living past best still danger,1
2058,danger,,fear way making see danger logic behind situation find courage engage,0
2059,dead,,book act,0
2060,dead,afghanistan,dead aircraft military helicopter remote region,1
2061,dead,sweden,even awesome landscape load atmosphere life wasteland,0
2062,dead,,miss longer dead anyways even hair,0
2063,dead,,law killing unless dead person something,0
2064,dead,london,remember time gave life dead hell,0
2065,dead,fl,bee like legit zombie feel every sore part body,0
2066,dead,,get road right behind bus dead serious,0
2067,dead,atmosphere,dead,0
2068,dead,,watched know slightly attractive man ross got beat dead,1
2069,dead,glasgow,need confirm ross dead cause dont trust anyone else,0
2070,dead,,walking good character real many performance,0
2071,dead,,hundred feared dead migrant boat rescue,1
2072,dead,somewhere portugal,war came see never see waved white flag front end dead wont,0
2073,dead,south stand,oh sake dead,0
2074,dead,dundalk ireland,ross really,0
2075,dead,,avoid wearing dead black flaming red stark white much go blue gold brown even,0
2076,dead,,perspective grateful critical writing study,1
2077,dead,ru,looking cold saw site link maybe share,0
2078,dead,,hard new trend,0
2079,dead,south stand,said dead one else,0
2080,dead,forever,ross dead,0
2081,dead,oh,thinking time friend dead alone great alone free front row,0
2082,dead,united state,typhoon taking dead aim,1
2083,dead,,emotional ross,0
2084,dead,planet earth,man found dead demi swimming,1
2085,dead,spare,dead suing,1
2086,dead,,dead,0
2087,dead,united state,road dead awesome awesome ending awesome,0
2088,dead,milton keynes,believe ross,0
2089,death,,call text love boy hold attention like,0
2090,death,,hate talking mean love death talk damn much,0
2091,death,uptown,death forever rep,1
2092,death,,vibrator shaped done busted,0
2093,death,prov,death threat life well gon see,0
2094,death,mi,adult plague colorado,1
2095,death,new york,pro console ring full read,0
2096,death,buenos argentina,going back death,1
2097,death,go,year later see change real,0
2098,death,,enjoy era say support,0
2099,death,,feel like death,0
2100,death,uk,video hazard death sport,0
2101,death,,tell cousin text saying coming honestly death wish,0
2102,death,,judge order recognize spouse death certificate,0
2103,death,,loyalty mission kicking nobleman love,0
2104,death,md,way right unto man end thereof way,1
2105,death,,thanks narrowly averted death fun right,1
2106,death,,death,0
2108,death,,going starve death,0
2109,death,,ted bash comparison shouting,0
2110,death,,death,0
2111,death,,new knowing punishable death,0
2112,death,usa,issue death smoochy awakening clip reason bicentennial man pain,0
2113,death,right,ted bash comparison shouting,1
2114,death,cyprus,news mullah death may split rank demise would certainly,1
2115,death,kansa,feel like,0
2116,death,los usa,slain journalist unknowingly death via,0
2117,death,,old lady death metal sedan downtown smoking found real,0
2118,death,carry,peace talk doubt mullah death financial time mullah,0
2119,death,home,death,0
2120,death,new new york,first trial death,0
2121,death,,year ago week anniversary death,0
2122,death,,hint snippet death,0
2123,death,chicago,tomorrow death,0
2124,death,spain,disease death toll rise follow,1
2125,death,,death measles complication yr everyone dead legionnaire month cricket,1
2126,death,,bigamist wife death pregnant wife child mother nephew,0
2127,death,nc,get huge wreck airlift maybe death interstate completely blocked,1
2128,death,maine,case voter fraud need new gun death actually law,1
2129,death,sicily,shipwreck child death,1
2130,death,,ak bloody rifle blame death,1
2131,death,,breast milk original rate child death last,0
2132,death,nj,death running crash pedestrian bicyclist vehicle occupant hit,1
2133,death,,death per year physician avoid one,1
2134,death,,death measles complication yr everyone dead legionnaire month cricket,1
2135,death,,bigamist wife death pregnant wife child news,0
2136,death,uk,death year,1
2137,death,ga,hear talk avoid thousand resistant next,0
2138,death,planet earth,irony thousand,0
2139,death,wakanda,usually objective maybe uncle ben death end business usual,0
2140,death,lagos,death older data tell,1
2141,death,really,death,1
2142,death,,never know would think belief warranted death innocent jap,1
2143,death,screen,real magic real went missing town focus probe strange death,1
2144,death,az,two case constitute plague health,1
2145,death,really,death,0
2146,death,edinburgh,lunch couple hour good finally find,0
2147,death,weyburn,police warn public death province,1
2148,death,uga alumnus economics,none annoying crusty life head as people ever actually support cause hate black death get,0
2149,death,,time reduce gun death,1
2150,death,,high auto death child guess run better adult,0
2151,death,blackpool,cancer equate around death sign could save,1
2152,death,,reverse situation know civilian death specifically make political,1
2153,death,london,there two death murder kill,0
2154,death,,horrible death trapped ship knew,1
2155,death,jordan,minister attack mosque least death,1
2156,death,blackpool,cancer equate around death sign could save,1
2157,death,,climate two plague death colorado,1
2158,death,,since year sander born roundhouse kick related death,1
2159,death,columbia mn,taking step keep child safe hot take look innovative car seat,0
2160,death,top secret,beluga death average age year,1
2161,death,,bigamist wife death pregnant wife child,1
2162,death,top secret bunker,reduce cyclist death compulsory highway code test every vehicle us,1
2163,debris,england,plane debris missing part aircraft wing found reunion island,1
2164,debris,,flight ago debris found south ocean,1
2165,debris,,aircraft debris found la reunion missing,1
2166,debris,temperance permenence,discovered plane debris missing flight time,1
2167,debris,,confirmed debris,1
2168,debris,,aircraft debris found la reunion missing,1
2169,debris,nigeria,plane debris washed reunion island flight,1
2170,debris,,aircraft debris found la reunion missing,1
2171,debris,,missing debris could new york time,1
2172,debris,,debris almost surely flight official say new york time,1
2173,debris,,debris almost surely flight official say new york time,1
2174,debris,shadow,debris found reunion island flight mystery behind plane disappearance could better,1
2175,debris,,aircraft debris found la reunion missing,1
2176,debris,campo,debris confirmed relative hope discovery crash site,1
2177,debris,nbc washington,official say debris found reunion island,1
2178,debris,,debris found reunion sad tragedy innocent crash,1
2179,debris,seattle,love food fun prime minister confirmed aircraft debris found,1
2180,debris,ontario canada,seem certain debris missing,1
2181,debris,new york,official say debris found reunion island,1
2182,debris,,aircraft debris found la reunion missing,1
2183,debris,,debris found reunion island come,1
2184,debris,,aircraft debris found island,1
2185,debris,united arab emirate,irony debris flight found,1
2186,debris,india,aircraft debris found la reunion missing,1
2187,debris,hong kong,reunion debris missing flight,1
2188,debris,germany,expert leave lab debris,1
2189,debris,nigeria,plane debris washed reunion island flight,1
2190,debris,iraq,debris confirmed relative hope discovery crash,1
2191,debris,,plane debris discovered reunion island flight,1
2192,debris,fl,debris confirmed relative hope discovery crash official confirm,1
2193,debris,world news,aircraft debris found la reunion missing piece aircraft debris,1
2194,debris,hong kong,reunion island debris,1
2195,debris,,debris confirmed relative hope discovery crash site via video,1
2196,debris,hong kong,plane debris missing,1
2197,debris,,aircraft debris found la reunion missing news,1
2198,debris,uk,aircraft debris found la reunion missing please,1
2199,debris,malaysia,aircraft debris confirmed nation star,1
2200,deluge,united kingdom,awash abstract tweet,0
2201,deluge,right next,bet mother nature might plan send deluge,0
2202,deluge,ct nyc,feed deluge twice,0
2203,deluge,,twitter find important stuff amongst loving music,0
2204,deluge,,fall package deal deluge tour,0
2205,deluge,england,sincerely inevitable deluge tweet hold grudge decide baking cake,0
2206,deluge,los ca,deluge resource flood medical provider cleanup worker,1
2207,deluge,,towboat trek sympathy deluge,1
2208,deluge,,deluge eulogy soul,0
2209,deluge,australia,wa smile deluge west via,0
2210,deluge,brisbane,china delaying fundamental economy support valuation stock,0
2211,deluge,,despite deluge notice man still ticket like,0
2212,deluge,,colorado,0
2213,deluge,brackley canada,deluge one hour get,0
2214,deluge,london,many men twitter normally embrace odd torso scale deluge unprecedented,0
2215,deluge,,yes man bad week far event deluge turned right around,0
2216,deluge,england,best window torrent deluge look like written year ago swing worse,0
2217,deluge,earth,fifth king legendary period deluge,0
2218,deluge,,deluge hell vine,0
2219,deluge,,strange encaustic cerography portion till give voice,0
2220,deluge,enniscrone sligo,back beach surf camp surf therapy today,1
2221,deluge,mostly nz,forecast based dressing incessant,0
2222,deluge,london,perhaps applied deluge recently exposed truly scale,1
2223,deluge,,sometimes back truck descriptive deluge indecency,0
2224,deluge,usa,business owner share would differently,0
2225,deluge,,whole slew post coming hosting deluge,0
2226,deluge,,heaven sent warm morning river early,0
2227,deluge,,thing got soaked deluge going pad,0
2228,deluge,,awesome idea like much,0
2229,deluge,,wrinkled face deluge,0
2230,deluge,,teaching class student lot question like sorry deluge,0
2231,deluge,ga,save big easy deluge supernatural read,0
2232,deluge,world,content marketing via,0
2233,deluge,,love song sing church,0
2234,deluge,fort ohio,remember reading deluge post losing,0
2235,deluge,new ny,deluge incremental story world wanting go away,0
2236,deluge,fort fl,search powerful content improve business deluge,1
2237,deluge,raleigh nc,missing exhibitor,0
2238,deluge,,got method meditation deluge divine blessing happy peaceful,0
2239,deluge,newcastle upon tyne,deluge top timing quite believe,1
2240,deluge,walking tightrope,tomorrow almost look deluge stuff downright lie,0
2241,deluge,frascati,turner shade darkness evening deluge,0
2242,deluged,college tx,anyone else getting ton call cell,0
2243,deluged,bishop england,sure shop local child wanting buy,0
2244,deluged,,make colour shape likely rise top,0
2245,deluged,pakistan,heavy rainfall,1
2246,deluged,,business make stand shape rise top,0
2247,deluged,hill,also matter week going poorly written fiction teen blood,0
2248,deluged,,business make stand colour shape likely top,0
2249,deluged,,business make stand colour shape likely rise top,0
2250,deluged,london,low take,1
2251,deluged,,business make stand colour likely rise top,0
2252,deluged,fl,reason bring running murphy nothing republican junk,0
2253,deluged,manchester,low take,0
2254,deluged,wellington,whoever hold address going meant,0
2255,deluged,,tarp protecting outfield cannot infield getting,1
2256,deluged,,business stand colour shape likely rise top,0
2257,deluged,libya,eu state squabble one dead tunnel,1
2258,deluged,,business make stand colour shame likely rise top,0
2259,deluged,,business make stand colour shape rise top,0
2260,deluged,,business make stand colour shape likely rise top,1
2261,deluged,,department commerce last two month,0
2262,deluged,newcastle,feel low take,0
2263,deluged,,business make stand shape likely rise top,0
2264,deluged,,business make ur stand colour shape likely rise top,0
2265,deluged,los ca,forgive bit hatred lost,0
2266,deluged,pakistan,news alert heavy rainfall,1
2267,deluged,balvanera,alone hour savour prolong almost physical intensity feeling,0
2268,deluged,aro diaspora,come flying ant capital annual swarm winged insect,1
2269,demolish,washington,rand debate strategy bad idea point maybe,1
2270,demolish,worldwide,government demolish illegal structure international conference,0
2271,demolish,,government demolish illegal structure international conference state government,0
2272,demolish,eastbourne england,silver architect permission demolish tower replace,0
2273,demolish,state dreaming,four demolish,0
2274,demolish,,state government set recover portion international conference,0
2275,demolish,,listening demolish wait bait patriot hater discussion,0
2276,demolish,,ugh hungry going demolish,0
2277,demolish,,space,0
2278,demolish,wema building,government demolish illegal structure international conference,0
2279,demolish,port nigeria,government demolish illegal structure international conference,1
2280,demolish,fruit bowl,mutual host preset bal radar demolish,0
2281,demolish,south africa,yea demolish boundary seem set negative,0
2282,demolish,hooter peachtree,nothing midget demolish show respect,0
2283,demolish,mi,set demolish fitness inspiration,0
2284,demolish,,set goal demolish,0
2285,demolish,mad hell,terrorist demolish structure jordan valley,1
2286,demolish,ga,watching right first fight demolish guy,0
2287,demolish,akwa ibom nigeria,think come demolish building member,0
2288,demolish,,read already remains one favorite article like demolish,0
2289,demolish,london,imagine demolish everyone,0
2290,demolish,rhodeisland,absurdly ridiculous fashion demolish,0
2291,demolish,uk,far right racist call destruction previously also,1
2292,demolish,london,could demolish right,0
2293,demolish,ca,postal service sell demolish downtown building,0
2294,demolish,nigeria,government demolish illegal structure international conference daily post,0
2295,demolish,,quest android game,0
2296,demolish,kolkata,said terrorist demolish house right take,0
2297,demolish,north west,think become businessman demolish community build troupe,0
2298,demolish,earth,first counter league game another demolish totally appreciate people play,0
2299,demolish,nyhc,think going demolish house know life next,1
2300,demolish,sweden,added video dan demolish giant gummy bear,0
2301,demolish,arbailo,demolish ur face nostril stop whether really worth embarrassment,0
2302,demolish,bagalkote karnataka,demolish falling state anyway take engineer,0
2303,demolished,shrewsbury,tapa evening good,0
2304,demolished,nj,ball,0
2305,demolished,terre,bought jar peanut butter getting,0
2306,demolished,nh via,get patriot like whine,0
2307,demolished,canada,make feel better level still get,0
2308,demolished,scotland,every case yes utterly embarrassed bring indy ever,0
2309,demolished,,still got video,0
2310,demolished,,got first troll upset,1
2311,demolished,,church medium silent house,1
2312,demolished,atl,man cam as hungry,0
2313,demolished,,finally spring property sat vacant,0
2314,demolished,beautiful british columbia,absolutely sounder start finish,0
2315,demolished,,meerkat get periscope live,0
2316,demolished,,snowball,0
2317,demolished,newcastle,finally spring property sat vacant,0
2318,demolished,chicago,home since home,1
2319,demolished,,take china get sent back stone age,0
2320,demolished,ireland,suite office coming bistro former bistro soon,0
2321,demolished,usa,latest six west bank home,1
2322,demolished,,trump get absolutely general,0
2323,demolished,,finally spring property sat vacant,0
2324,demolished,birmingham uk,totally beautiful film almost people agreed,1
2325,demolished,oregon,property downtown phoenix,0
2326,demolished,spain,personal best,0
