,keyword,location,text,labels
0,,,deed reason earthquake may forgive,1
1,,,forest fire near la canada,1
2,,,resident notified evacuation shelter place order,1
3,,,people receive wildfire evacuation order,1
4,,,got sent photo ruby smoke wildfire school,1
5,,,update closed direction due lake county fire wildfire,1
6,,,flood disaster heavy rain cause flash flooding street colorado spring area,1
7,,,top hill see fire,1
8,,,emergency evacuation happening building across street,1
9,,,afraid tornado coming,1
10,,,three people heat wave far,1
11,,,south getting flooded wait second live south flooding,1
12,,,flooding lost count,1
13,,,flood bago bago,1
14,,,damage school bus car crash breaking,1
16,,,love fruit,0
17,,,summer lovely,0
18,,,car fast,0
21,,,cool,0
22,,,love skiing,0
23,,,wonderful,0
25,,,eat,0
26,,,last,0
27,,,love,0
29,,,like,0
31,ablaze,birmingham,wholesale market ablaze,1
32,ablaze,september bristol,always try bring metal,0
33,ablaze,africa,breaking flag set ablaze,1
34,ablaze,pa,cry set ablaze,0
35,ablaze,uk,plus side look sky last night ablaze,0
36,ablaze,pretoria,built much around new acquisition doubt set ablaze,0
37,ablaze,world,office set ablaze,1
38,ablaze,,two car set head st police,1
39,ablaze,paranaque city,ablaze lord,0
40,ablaze,live webcam,check,0
41,ablaze,,outside ablaze dead inside,0
42,ablaze,milky way,awesome time visiting head office site thanks taking care,0
43,ablaze,,ablaze,0
44,ablaze,,set ablaze,0
45,ablaze,,follower last know grow,0
46,ablaze,carolina,west thousand wildfire ablaze alone,1
47,ablaze,,building perfect life leave street ablaze,0
48,ablaze,live webcam,check,0
49,ablaze,,first night retainer quite better get used wear every single night next year,0
50,ablaze,sheffield ohio,man shot home set ablaze,1
51,ablaze,india,man wife get six year jail setting ablaze,1
52,ablaze,barbados,head st police superintendent salmon,0
53,ablaze,anaheim,arsonist deliberately set black church north,1
54,ablaze,abuja,happy see teammate training hard,0
55,ablaze,usa,flag later set ablaze office front,1
56,ablaze,south africa,truck ablaze outside tambo cargo,1
57,ablaze,sao brazil,set heart ablaze every city gift every like kiss upon lip,0
58,ablaze,hollywoodland,sky ablaze tonight filled sunset shot know,0
59,ablaze,alberta treaty,west thousand wildfire ablaze alone climate energy,1
60,ablaze,,revel video mean mac farewell ablaze en route,0
61,ablaze,inang pamantasan,progressive month student would set pen ablaze torch,0
62,ablaze,twitter lockout progress,ablaze secret sky mar,0
63,ablaze,ca,fire something tinderbox clown setting ablaze,1
64,ablaze,ab,ablaze buff magnitude,0
65,ablaze,birmingham,huge fire wholesale market ablaze,1
66,ablaze,san francisco,ablaze time talk go know make due,0
67,accident,clvlnd,got bicycle accident split impossible father,0
68,accident,tn,accident traffic moving,1
69,accident,santa ca,accident center lane blocked great traffic,1
70,accident,uk,accident read advice see solicitor help,0
71,accident,mo,speeding among top cause teen accident car accident,0
72,accident,walker alabama,motor vehicle accident curry near please,1
73,accident,australia,live accident awareness,1
74,accident,north carolina,mile marker south vehicle accident ramp closed,1
75,accident,,sleeping pill double risk car accident,0
76,accident,norf carolina,knew gon happen,0
77,accident,san mateo ca,traffic accident mir,1
78,accident,north carolina,mile marker south vehicle accident congestion,1
79,accident,kenya,pastor scene owner range rover,1
80,accident,,get home fast accident truck spilt mayonnaise,0
81,accident,bedroom,horrible car accident past finally able get thank,1
82,accident,,wait see tell another,0
83,accident,tx,overturn interstate click,1
84,accident,south oh,accident traffic,1
85,accident,,motorcyclist crash car crossed motorcycle rider,1
86,accident,new hanover nc,property piner,1
87,accident,maldives,first accident turning onto near taxi halfway everyone,1
88,accident,nh,accident left lane blocked eddy stop go traffic back delay min traffic,1
89,accident,nc,property piner,1
90,accident,,accident,0
91,accident,new hanover nc,property st,1
92,accident,,traffic accident injury foreman,1
93,accident,global,actress accident,1
94,accident,alberta montana,accident,1
95,accident,charlotte,mile backup blocking right lane exit alternate,1
96,accident,baton la,accident help determine option financially support life care plan,0
97,accident,md,deadly motorcycle car accident detail,1
99,accident,,car even week got car accident drive,1
100,accident,uk,police previously road accident explosion,1
101,accident,kenya,still church leader coming forward comment accident issue disciplinary,0
102,aftershock,instagram heyimginog,live,0
103,aftershock,,man drive effort get painful man bannister,0
104,aftershock,switzerland,dance,0
105,aftershock,,victory bargain basement,0
106,aftershock,,dance,0
107,aftershock,,came,0
108,aftershock,instagram heyimginog,speaking someone people end getting,0
109,aftershock,,harder conflict glorious,0
110,aftershock,,going clay pigeon shooting cry,0
111,aftershock,somewhere know,guess one actually want free aftershock,0
112,aftershock,,aftershock terrifying best roller coaster ever,0
113,aftershock,belgium,aftershock,0
114,aftershock,switzerland,dance,0
115,aftershock,,dance,0
116,aftershock,,dance,0
117,aftershock,dope show,seeing issue aftershock,0
118,aftershock,switzerland,dance,0
119,aftershock,switzerland,dance,0
120,aftershock,canada,bonus minute daily habit could really improve many already,0
121,aftershock,baker city oregon,protect profit next global financial,0
122,aftershock,,moment get scary roller coaster guy behind screaming bloody murder silverwood aftershock,0
123,aftershock,,aftershock streaming,0
124,aftershock,united state,aftershock protect profit next global book,0
125,aftershock,,sometimes face difficulty something wrong something,0
126,aftershock,,thing stand dream try belief actually brown,0
127,aftershock,marysville ca,praise god ministry tell like,0
128,aftershock,,going die best way know avoid trap thinking something job,0
129,aftershock,hermosa ca,tried orange aftershock life never,0
130,aftershock,,love,0
131,aftershock,,aftershock,0
132,aftershock,,aftershock back school kick want thank everyone making great,0
133,aftershock,,people say cannot done interrupt shaw,0
134,aftershock,,first man get oyster second man get,0
135,aftershock,,anyone need play hybrid slayer,0
136,,,expert begin examining airplane debris found reunion air accident expert news,1
137,,pennsylvania,strict liability context airplane pilot error common component aviation,1
138,,salt lake utah,lifetime odds dying airplane accident,0
139,,palo ca,expert begin examining airplane debris found reunion air accident expert,1
140,,,airplane accident die good,1
141,,spain fl,family member bin laden airplane accident suspect,1
142,,india,man go airplane engine via,1
143,,hyderabad telangana india,horrible accident man wing airplane,1
144,,eagle texas,airplane accident four men state government,1
145,,bangalore,horrible accident man wing airplane,1
146,,financial news view,expert begin examining airplane debris found reunion island air accident expert,1
147,,,expert begin examining airplane debris found reunion air accident expert examining,1
148,,indonesia,rip family member accident,1
149,,boyfriend leg,almost sent nude accident thank god airplane mode,0
150,,new usa,might airplane accident night car politics,0
151,,somewhere,expert begin examining airplane debris found reunion air accident expert,1
152,,,unbelievably airport airplane aircraft aeroplane runway accident,1
153,,mumbai india,horrible accident man wing,1
154,,sri lanka,horrible accident man wing airplane,1
155,,resident,bin family dead airplane naturally,1
156,,,pilot plane crash car festival via crash aircraft airplane pilot death accident,1
157,,lehigh pa,strict liability context airplane accident,1
158,,canada,expert begin examining airplane debris found reunion air accident,1
159,,,expert begin examining airplane debris found reunion air accident expert,1
160,,thrissur,horrible accident man wing believe eye,1
161,,havenford,fletcher one victim airplane time accident left little bit trauma although,1
162,,india,horrible accident man wing,1
163,,,believe rip accident,1
164,,,expert begin examining airplane debris found reunion air accident expert examining,1
165,,israel,airplane,1
166,,fashion,phone look like car ship airplane terrible,0
167,,san ca,statistically risk getting cop dying airplane,0
168,,italy,airplane crash house people die accident,1
169,,nyc,shooting airplane accident,1
170,,toronto,could drone cause airplane pilot worried use drone close vicinity airport,1
171,ambulance,,early wake call sister begging come ride ambulance hospital,1
172,ambulance,jackson,twelve feared air ambulance helicopter crash,1
173,ambulance,new york worldwide,two air ambulance scene serious crash two car lorry,1
174,ambulance,,twelve feared air ambulance helicopter crash,1
175,ambulance,new la,leading emergency service welcome new ambulance charity,0
176,ambulance,west wale,anyone right service halt outside ambulance,1
177,ambulance,,twelve feared air ambulance helicopter crash,1
178,ambulance,happily married kid,ambulance sprinter automatic vehicle choice compliant,0
179,ambulance,,new device able target destroy blood clot,0
180,ambulance,arizona,crazy fight ambulance couple pit,1
181,ambulance,mumbai,get run ambulance,0
182,ambulance,,news twelve feared air ambulance helicopter crash,1
183,ambulance,amsterdam,twelve feared air ambulance helicopter crash,1
184,ambulance,,waiting ambulance,0
185,ambulance,,need,0
186,ambulance,happily married kid,ambulance sprinter automatic vehicle choice compliant,0
187,ambulance,,air ambulance helicopter crash kill nine,1
188,ambulance,vt,need medical assistance call ambulance need,0
189,ambulance,north usa,petition per hour em ambulance,0
190,ambulance,,twelve feared air ambulance helicopter crash,1
191,ambulance,karachi,twelve feared air ambulance helicopter crash,1
192,ambulance,happily married kid,ambulance sprinter automatic vehicle choice compliant,0
193,ambulance,happily married kid,ambulance sprinter automatic vehicle choice compliant,0
194,ambulance,loveland colorado,check parking said last year ambulance st,0
195,ambulance,,know way ambulance coming,1
196,ambulance,,twelve feared air ambulance helicopter crash,1
197,ambulance,,twelve feared air ambulance helicopter crash,1
198,ambulance,,ambulance right outside work,0
199,ambulance,canada,dog think ambulance,0
200,ambulance,visit youtube,happening em ambulance dual siren,0
201,ambulance,lexington,twelve feared air ambulance helicopter crash,1
202,ambulance,,twelve feared air ambulance helicopter crash,1
203,ambulance,usa,twelve feared air ambulance helicopter crash,1
204,ambulance,germany,twelve feared air ambulance helicopter crash,1
205,ambulance,,police ambulance number body,0
206,ambulance,,still cannot clinical practice across ambulance,0
207,ambulance,playa,twelve feared air ambulance helicopter crash,1
208,ambulance,nc,people try ambulance hate,0
209,annihilated,higher place,episode trunk,0
210,annihilated,mi,shall laid shall kneel,0
212,annihilated,boksburg,previous meeting,0
213,annihilated,,past season even ended career compete,0
215,annihilated,,status education behalf easy street,0
216,annihilated,,everything,0
217,annihilated,greater uk,good un sorry get,0
218,annihilated,boston,cop pull drunk driver safety second car hit via,1
219,annihilated,,must,0
220,annihilated,,cop pull drunk driver safety second car hit via,1
221,annihilated,canopy kingdom,country entirely,0
222,annihilated,,would might well thank,0
223,annihilated,usa,one thing horror,0
224,annihilated,,guess since spent history getting,1
225,annihilated,,year since people instantly aware ability annihilate whole humanity,1
226,annihilated,zone layer,day tryout went good minus fact stopped quickly get short ball toenail injury even,0
227,annihilated,london,symbol peninsula,1
228,annihilated,trancy manor,everything,0
229,annihilated,,ready get game,1
230,annihilated,south,people last night really thought would forecast,1
231,annihilated,,domain sophistication closely,0
232,annihilated,west,seen priest rob came scorpion astonishing gig,0
233,annihilated,pa,officially skipping getting,0
234,annihilated,,thus explaining case survivor godlike,1
235,annihilated,view six,completely time alive,0
236,annihilated,,legion survivor imperfect hybrid project quickly formed new secret cell,0
237,annihilated,university toronto,match last year great brock guy,0
238,annihilated,,cop pull drunk driver safety second car hit via,1
239,annihilated,swaning around,army grind gang manure,1
240,annihilated,,completely forthright may also food coma also,0
241,annihilated,london,fun filled bar handsome one got apart,0
243,annihilation,usa,hell fraction belief total annihilation destruction,1
244,annihilation,,maybe call tell sorry sold river,0
245,annihilation,,annihilation civilization,0
246,annihilation,,national park service national stop annihilation salt river wild via change,0
247,annihilation,wild wild web,quarterstaff annihilation,1
248,annihilation,subconscious la,world annihilation self transformation alien attack exterminate human,0
249,annihilation,spain,via,1
250,annihilation,,national park service national stop annihilation salt river wild via change,0
251,annihilation,ca boston,national park service national stop annihilation salt river wild via change,1
252,annihilation,yeezy taught nv,please sign share petition save wild horse,0
253,annihilation,,national park service national stop annihilation salt river wild via change,1
254,annihilation,ca boston,please check salt river horse help stop annihilation happen without,0
255,annihilation,united state,soul,0
256,annihilation,,mention major contributor annihilation,1
257,annihilation,,need horse sign stand voice,1
258,annihilation,rock sc,reject law misguided false prophet imprison nation self annihilation,0
259,annihilation,az,national park service national stop annihilation salt river wild via change,0
260,annihilation,republic texas,annihilation hour god allow least one full,0
261,annihilation,,need please sign take stand voice,0
262,annihilation,,need horse sign stand voice,0
263,annihilation,az,hey sign petition save,0
264,annihilation,slovenia,stop annihilation salt river wild via change,1
265,annihilation,connecticut,current nova tied book rider annihilation,0
266,annihilation,,national park service national stop annihilation salt river wild via change,0
267,annihilation,,please sign save,0
268,annihilation,,count join following annihilation,0
269,annihilation,subconscious la,world annihilation self transformation alien attack exterminate human,1
270,annihilation,big,national park service national stop annihilation salt river wild via change,0
271,annihilation,az,national park service national stop annihilation salt river wild via change,1
272,apocalypse,colorado,fight soon get,0
273,apocalypse,sindria,survive apocalypse feel horrible poor boy child,1
274,apocalypse,,another birthday apocalypse,0
275,apocalypse,,adaptation apocalypse film,0
276,apocalypse,texas,apocalypse please,0
277,apocalypse,elk usa,another august red rover zombie apocalypse,1
278,apocalypse,texas,feel like one stage,0
279,apocalypse,,hot radio disease apocalypse,0
280,apocalypse,shire,apocalypse,0
281,apocalypse,tx,know question interpretation sign,1
282,apocalypse,oakland,apocalypse version,0
283,apocalypse,,apocalypse upon,0
284,apocalypse,,night lucky block apocalypse wither showcase,0
285,apocalypse,albuquerque,day one snow apocalypse,1
286,apocalypse,,short spirit angel took top enormous high mountain,0
287,apocalypse,buenos argentina,imagine zombie apocalypse fighting back back heart heart conversation,0
288,apocalypse,,video night lucky block apocalypse wither,0
289,apocalypse,,planet lone audience,0
290,apocalypse,san tx,dad bought look like science doc front read back actually impending apocalypse,1
291,apocalypse,san francisco,apocalypse come week know,0
292,apocalypse,usa,go look grizzly peak right look like beginning apocalypse movie,0
293,apocalypse,tx,niece apocalypse,0
294,apocalypse,buffalo ny,storm latest set photo via,1
295,apocalypse,,night lucky block apocalypse wither showcase via,0
296,apocalypse,,shot heart going totally give love bad name heart,0
297,apocalypse,,play dark soul day,0
298,apocalypse,la vega,know go zombie take,0
299,apocalypse,,latest storm queen apocalypse,1
300,apocalypse,,shadow boxing apocalypse,1
301,apocalypse,,short spirit angel took top enormous high mountain,1
302,apocalypse,tokyo,attack every time see poster freshly clean everyone,0
303,apocalypse,,video night lucky block apocalypse wither showcase,0
304,armageddon,united state,kill flag fast reason,0
305,armageddon,united state,kill flag fast reason,0
306,armageddon,flightcity uk,prod,0
307,armageddon,,peace love,0
308,armageddon,,best movie ever,0
309,armageddon,alphen aan den holland,bed wake unless revolution,0
310,armageddon,,red full read,0
311,armageddon,wrigley field,already know world series,0
312,armageddon,,love truelove romance lith voodoo seduction astrology apocalypse,0
313,armageddon,probably strip club,beat hao got flawless first try,0
314,armageddon,canada,ben know girl help since,0
315,armageddon,england,long coat hand worn certainty bear sense,0
316,armageddon,usa,phone hidden back door data mining financial,0
317,armageddon,united state,kill flag fast reason,1
318,armageddon,,love truelove romance lith voodoo seduction astrology apocalypse,0
319,armageddon,united state,kill flag fast reason,0
320,armageddon,new york city,sketch based taste episode,0
322,armageddon,,luck tomorrow night coefficient point,0
324,armageddon,,another one history justice way income tax,0
325,armageddon,usa,issue major warning late escape,1
326,armageddon,worldwide,kingdom rule people earth,0
327,armageddon,,entertainment lot movie die hard monkey sixth auction,0
328,armageddon,,talk goof guild come right,0
329,armageddon,east coast,niece gaining ability getting prepared toddler apocalypse,0
330,armageddon,california,check doomsday must library collection survival via,0
331,armageddon,,thought yesterday saw scary,1
332,armageddon,,think already come year gog,0
333,armageddon,orwellion,sadly window ethic,0
334,armageddon,ca,averted el,0
335,armageddon,finland,time hour latest series blueprint extremely,0
336,armageddon,east kilbride,till,0
337,armageddon,,united convert soon die,0
338,armageddon,flightcity uk,prod,0
339,armageddon,middle eastern palace,tomorrow day start,0
340,armageddon,kent,lee working class tory prepare,0
341,armageddon,,chart prove financial crisis part financial economic collapse track,0
342,armageddon,,issue major warning late escape russia,1
343,armageddon,,stage right get staff,0
345,armageddon,perthshire,well done finger crossed tomorrow,0
346,army,,pick fan army,0
347,army,,one direction pick fan army,0
348,army,,second summer pick fan army,0
349,army,,pick fan army,0
350,army,,pick fan army,0
351,army,,one direction pick fan army,0
352,army,,seeing army first thing slightly got far,0
353,army,cyprus,build kingdom lead army friend,0
354,army,tn,salvation army host rally reconnect father salvation army hosting back school,1
355,army,,vote queen round billboard,0
356,army,studio,build army dog leader lion dog fight like,1
357,army,ca,review,0
358,army,,one direction pick fan army,1
359,army,new york,infantry men dial army quartz wrist watch sport blue nylon fabric full,0
360,army,,one direction pick fan army,0
361,army,,swiss army date rubber mop watch,1
362,army,pakistan,army,0
363,army,,second summer pick fan army,0
364,army,,pick fan army,0
365,army,,one direction pick fan army,0
366,army,campinas sp,da one spear,0
367,army,,one direction pick fan army,0
368,army,new york,stony last hope lead army felon thus army reject army satan,0
369,army,new york,army navy military japan leather watch war full read,0
370,army,,pick fan army,0
371,army,,pick fan army,0
372,army,,pick fan army,0
373,army,,pick fan army,0
374,army,dc,kaiser member river learn,0
375,army,,violent country get army involved help control killing bring back peace poor,1
376,army,new york,army navy military japan leather watch war full read,0
377,army,,army navy military japan leather watch war full read,0
378,army,,one direction pick fan army,0
379,army,,one direction pick fan army,0
380,arson,,two terrorist arson ugly truth,0
381,arson,washington,authority say struggling solve arson case like,1
382,arson,usa,thousand attend rally organized peace arson attack took life,1
383,arson,nc,add familia arson,0
384,arson,empire state,another fake hate crime burn house else new,1
385,arson,,arson suspect linked fire caught northern,1
386,arson,,mourning notice stabbing arson victim stir,1
387,arson,jerusalem,mourning notice stabbing arson victim stir,1
388,arson,pennsylvania,sound arson,0
389,arson,wi,owner gay bar arson scheme,0
390,arson,zero branco,wait,0
391,arson,republic texas,arson suspect linked fire caught northern,1
392,arson,,trial date set man arson burglary,1
393,arson,bajaur,death toddler crack,1
394,arson,usa,teen amid protest arson attack,1
395,arson,kenya,police hunt student arson police hunt,1
396,arson,,getting thick shoulder poor,1
397,arson,jerusalem,mourning notice stabbing arson victim stir poster,0
398,arson,,arson suspect linked fire caught northern,1
399,arson,,leader hospital family arson via,1
400,arson,los ca,owner gay bar arson scheme via,0
401,arson,singapore,angel arson,0
402,arson,kenya,police hunt student arson police hunt,1
403,arson,,mourning notice stabbing arson victim stir,1
404,arson,chicago,owner gay bar arson scheme via,0
405,arson,earth,owner gay bar arson scheme,0
406,arson,israel,mourning notice stabbing arson victim stir,1
407,arson,,owner gay bar arson scheme,1
408,arson,wi,arson suspect linked fire caught northern,1
409,arson,,couple hate crime home,1
410,arson,,arson suspect linked fire caught northern time,1
411,arson,,arson suspect linked fire caught northern,1
412,arsonist,,hate white people mo,1
413,arsonist,atlanta,arsonist,0
414,arsonist,earth,east bay serial arsonist,1
415,arsonist,,minor citation substance facing time,0
416,arsonist,worldwide,suspected serial arsonist,1
417,arsonist,bleak house,arson suspect linked fire caught northern,1
418,arsonist,,legal system never,0
419,arsonist,,dick,0
420,arsonist,toronto,arsonist also burned mattress st,0
421,arsonist,blonde bi,arsonist,0
422,arsonist,america,anything nice say come sit,0
423,arsonist,nyc islamophobe,vegetarian video show arsonist popular restaurant strictly,0
424,arsonist,sf bay area,arsonist setting many watch,1
425,arsonist,orange california,video capture man removing flag long beach ca home burning arsonist sought,0
426,arsonist,,trick think nasty thing,0
427,arsonist,winston north carolina,spotlight take paradise arsonist,0
428,arsonist,,make,0
429,arsonist,,town melted ice cube arsonist,0
430,arsonist,south australia,arsonist blamed blaze plastic business,0
432,arsonist,,zodiac girl feat trey chuck da arsonist,0
434,arsonist,california,east bay serial arsonist,1
435,arsonist,,still cant,0
436,arsonist,snapchat,guess say thinking,0
437,arsonist,new york,arsonist set vegetarian restaurant police,1
438,arsonist,,video town win arsonist,0
439,arsonist,,whats cracking,0
440,arsonist,,smoke good eat drink drive nice car wear green mink,0
441,arsonist,,kill got court day earl,0
442,arsonist,,real live go,0
443,arsonist,united state,owner gay bar arson frank guilty arsonist,0
444,arsonist,,trusting stop terrorism like inviting arsonist join fire brigade telegraph,0
445,arsonist,,big top burning true story arsonist missing girl,1
446,attack,tx,stay civil liberty constant,1
447,attack,nyc,credit inspiring rediscover,0
448,attack,,theater gun grabber demand,1
449,attack,location,terror attack post,1
450,attack,selena britney hilary,demi really think heart attack sold million copy,0
451,attack,,scare new version nuclear attack warning like knowing government still prepare,1
452,attack,,claim suicide mosque least,1
453,attack,ireland,part twitter feminist try attack,0
454,attack,freeport usa,horrific attack wife news,1
455,attack,,blast accused heart attack,1
456,attack,dubai,drone attack kill militant north,1
457,attack,az,suspect latest theater attack psychological issue,1
458,attack,india,militant attack police post injured,1
459,attack,seattle wa,official gave terrorist weapon used attack,1
460,attack,,government provide free treatment acid attack victim private hospital,1
461,attack,bellevue ne,new post new relay attack steal user credential,1
462,attack,west gaza strip,force raid home car attack suspect,1
463,attack,,heart attack thought goat worry rocket,0
464,attack,,lie ready attack senior year,0
465,attack,united kingdom,hand side diamond graveyard shift attack right,0
466,attack,,volleyball attack volleyball training machine set simulation,1
467,attack,online even,tactful yet direct response attack hell yeah,1
468,attack,,assailant latest movie attack homeless psychological issue,1
469,attack,rowyso dallas,thanks damn heart attack,0
470,attack,ontario,suspect latest attack psychological issue,1
471,attack,mumbai,give evidence share terrorist use next,1
472,attack,oregon,illegal alien time rape murder maria ca woman prior offense,1
473,attack,fimak ist bolge muduru,strongly condemn attack ary news team cowardly act simply trying,1
474,attack,,theater gun grabber demand,1
475,attack,,fact atomic bomb say lot mentality went,1
476,attack,unite blue,everyone see ever attack dog hate group,0
477,attack,,heart disease secondhand,0
478,attack,ohio,tell hit,1
479,attack,,attack game vita wait,0
480,attack,global,theater gun grabber demand,1
481,attack,ph,anxiety attack,0
482,attacked,port ny,dog food,0
