,keyword,location,text,labels
3632,fatality,dc,fatality following suicide avoid area,1
3633,fatality,hope jamaica,road wisely prevent carnage fatality holiday,0
3634,fatality,jersey,mortal fatality gross interesting,0
3635,fatality,,looking like,0
3636,fatality,puritan ave,know fatality mortal,0
3637,fatality,,fatality slay,1
3638,fatality,oh,concerned mounting fatality,1
3639,fatality,,mortal fatality meat,0
3640,fatality,france,damage fatality atomic bomb,1
3641,fatality,canada,fatality serious injury result collision tch near,1
3642,fatality,italy,flood issue take stage fatality,1
3643,fatality,,zero spider fatality since,0
3644,fatality,oman muscat al seeb,video tremor,1
3645,fatality,san francisco,change language around traffic need go back future,0
3646,fatality,wisconsin,help family,0
3647,fatality,,main factor behind pedestrian fatality people failing yield,1
3648,fatality,indonesia slowly asia,mortal excellent fatality fun ever mortal version,0
3649,fatality,vancouver bc,drunk driving fatality say independent study,0
3650,fatality,,video mortal,0
3651,fatality,usa,la top city running fatality,1
3652,fatality,,confirm fatality tch remains closed due accident,1
3653,fatality,oh,casualty fatality five ten million,1
3654,fatality,,train accident fatality year running despite increase passenger journey,1
3655,fatality,north,fail see would bring number road fatality immensely,0
3656,fatality,pa,last public hearing today tomorrow address child abuse neglect fatality,1
3657,fatality,happy anywhere,yep considering fatality,1
3658,fatality,,shipping logistics fatality migrant boat hundred,1
3659,fatality,ohio,message board display traffic fatality new message beginning traffic death slow,1
3660,fatality,ireland,driver fatality road pedestrian cyclist risk,1
3661,fatality,,victory,0
3662,fatality,playing soccer eating pizza,right,0
3664,fatality,ny,savage account wonder quick fatality real,0
3665,fatality,hueco mundo,video fatality,0
3666,fatality,,irrespective pitch fatality,0
3668,fatality,boston cape cod,dying case fatality rate nearly,1
3669,fatality,,fatality like corpse still,1
3670,fatality,rafael castillo,fatality,0
3671,fatality,,wow fatality big rig hit motorcyclist blood everywhere,1
3672,fatality,new jersey,hit wit fatality wit cold,0
3673,fatality,fort,police investigating pedestrian fatality hit train,1
3674,fatality,nv,fatality,0
3675,fatality,,yes life fatality,0
3676,fatality,,many basket charming fatality mystery paranormal,0
3677,fatality,,making bad boy must see,0
3678,fatality,grand rapid mi,need need,0
3679,fatality,,soldier kill general fatality since,1
3680,fatality,,usually never,0
3682,fatality,utica ny,cat pleasant cat white average grass next north side,0
3684,fatality,,stage,0
3685,fatality,nunya,video every fatality make,0
3686,fatality,tx,fatality,0
3687,fatality,usa,police investigating pedestrian fatality hit train,0
3688,fatality,,fatality,1
3689,fatality,tx,fatality scary probably best falcon still,0
3690,fatality,,video fatality,0
3691,fatality,tn,truck crash expect long delay,1
3692,fatality,bishop england,yes report cow fatality well,1
3693,fatality,earth,video tremor might fatality tournament,0
3694,fatality,ny,added video fatality snow loser,0
3695,fatality,,death responsible birth certificate sole fatality nine plane,1
3696,fatality,honduras,fatality,0
3697,fatality,,everyday near death fatality thank god,0
3698,fear,uk,fear factory done,0
3699,fear,,made friend interesting combined,0
3700,fear,yewa zone,meaning picked one overcome fear behold catch,0
3701,fear,sitting new york,sometimes cheekiness computer screen recoil fear,0
3702,fear,,cause know every man fear woman say keeper got keep,0
3703,fear,,biggest fear disappointing people believe,0
3704,fear,carregado,want hurt fear drove midnight,0
3705,fear,md,men fear feeling passive aggressively commitment,0
3706,fear,,thing fear disturbance primary source,0
3707,fear,mexico,fear factory car,0
3708,fear,cape khayelitsha,understanding trust partner know fear,0
3709,fear,florida,thought nostril eye almost cried fear,0
3710,fear,,fear looking like know big one,0
3711,fear,,opposite love fear,1
3712,fear,,fear,0
3713,fear,stanford university,help win share lifetime fear,0
3714,fear,midwestern usa,must refuse become nation everyone living fear shot unawares intoxicated crazy,1
3715,fear,bedford,horror film made incredibly creative depth anatomy,1
3716,fear,,want special loathing la,0
3717,fear,la,worst,0
3718,fear,,magnum shaking fear hack planet,0
3719,fear,brazil,world say finish god fear,0
3720,fear,moment,fear unknown curiosity open,0
3721,fear,,love god fear hell,0
3722,fear,,tell bride give fear,0
3723,fear,alliston ontario,year fantasy football pool fear may win get as,0
3724,fear,,right fear,0
3725,fear,saudi arabia riyadh,live balanced balance fear hope mercy love,0
3726,fear,new ny,biggest fear eventually see way see,0
3727,fear,athens nicosia,couple fear let movie book saying sex,0
3728,fear,,nothing taking,1
3729,fear,southern california,untangle partner fill need love without fear listen,0
3730,fear,wa,walking dead spin fear walking dead,1
3731,fear,washington,fear,0
3732,fear,indonesia,fear lord start foolish use wisdom teaching,0
3733,fear,halifax,number people climate change polar bear article make fear future also humanity,0
3734,fear,hilton sc,hard almost nothing fear life reed,0
3735,fear,new york,never let fear get way,0
3736,fear,mo,fear,0
3737,fear,usa,daily hundred form fear,0
3738,fire,,morganite white fire opal sterling silver ring size,0
3739,fire,paulo,visto game throne fire,0
3740,fire,,save august fire department open house cypress st,0
3741,fire,,put fire still,0
3742,fire,high come,cause fire fire fire yeah fire fire fire,1
3743,fire,,header fire,0
3744,fire,wrex,auction shoe fire red,0
3745,fire,,fire,0
3746,fire,big boy,cry song ended setting fire,0
3747,fire,,setting thing fire always option,1
3748,fire,,sitting around fire sound great right,0
3749,fire,,see fire,0
3750,fire,brooklyn,put top,1
3752,fire,right,harry percent woman parenthood claim lie,0
3753,fire,mn,dear brought fire,0
3754,fire,,yeah need another middle class republican get hard working cop fire fighter teacher,0
3755,fire,,fire way close going,1
3756,fire,catwalk somewhere,fire meet gasoline always get twice,0
3757,fire,,tha bitch fire,0
3758,fire,zac newsome love,well feel like,0
3759,fire,kentucky,eye word icy burn like rum fire,0
3760,fire,,news harry percent woman parenthood claim,0
3761,fire,,nothing like good fire,1
3762,fire,makai,fire,0
3763,fire,fort,rent past year going,1
3764,fire,arizona,fire look picture,1
3765,fire,,overwork album fire overwork love take care,0
3766,fire,bc,promise tax pancake rainbow dying,0
3767,fire,nj,dis meek suppose actually fire,0
3768,fire,road success,set,1
3769,fire,desert,word mountain run boy,1
3770,fire,australia,checked fire,1
3771,fire,yuba ca,heart bigger obstacle front fire,0
3772,fire,,fire wave darkness,0
3773,fire,university south florida,may seem like fire little burnt,0
3774,fire,,smelling bon fire driving make sitting near one making,1
3775,fire,moon,dropping fire tomorrow saying ahead,0
3776,,niagara ontario,fire brant fire car call truck,1
3777,,woodcreek ca,fire truck behind light going move get,0
3778,,united state,fire truck service body fighting rescue safety equipment,0
3779,,,truck trailer catch fire,1
3780,,,wild night village every fire truck town like fire truck every house,1
3781,,,came along struck fire truck spinning around degree causing roll,1
3782,,district orange county,update closed trash truck fire,1
3783,,plain texas,look like murder scene cop fire truck fire assistance car along helicopter,1
3784,,southeast asia,former township fire truck used time,1
3785,,,former township fire truck used township assistant fire chief pat walker,1
3786,,,garbage truck really caught fire,0
3787,,,truck,1
3788,,,never good sign pull work five ambulance fire truck least,1
3789,,cnmi,fire truck ambulance phase hope,1
3790,,orange,north southbound closed due truck,1
3791,,lost thought,true truck caught,1
3792,,,mean fire truck back make good,0
3793,,five coffeeshop,came across fire video way saying hi fire,0
3794,,los angeles,past lane lane lane open trash truck fire,1
3795,,orange ca,north southbound closed due truck,1
3796,,five coffeeshop,found cool photo mine dodge bodied window ex fire department,1
3797,,,trident chevy fire truck pumper fire red ho plastic,0
3798,,fl,toddler bedding bundle fire truck sticker decal sign wall,0
3799,,,monster truck racer catch fire fair,1
3800,,laguna,truck fire clog canyon road,1
3801,,nevada carson st,truck trailer catch fire,1
3802,,,former township fire truck used emergency equipment,1
3803,,la,there fire truck parking lot,0
3804,,,evening sun article,0
3805,,,fire truck review kick push,0
3806,,,former township fire truck used time,0
3807,,,fire rescue engine awesome official jade via,1
3808,,aracaju sergipe,hour truck fire,1
3809,,,something first military true besides music,0
3810,,tennessee,grateful first responder save countless life,1
3811,,texas,praying healing safety first responder,0
3812,,long eaton  derbyshire  uk,join charity run start sun sept community first,0
3813,,worldwide,way book written include many vantage point first responder kindle,0
3814,,,first responder would never sent wrong address panic button safety,0
3815,,worldwide,say working curb first responder suicide,1
3816,,bc canada,cool teen becoming like call first friend need little help support,0
3817,,,cinema staff first responder safety,1
3818,,everywhere,thanks story first responder need,0
3819,,new york city,added first responder lost home page group,1
3820,,tn,thankful first responder especially life saving response today,1
3821,,,empire first responder turn national night,0
3822,,liberty ohio,red throw word hero around usually reserved first responder,0
3823,,aberdeenshire,want future first responder,0
3824,,los ca,still room party first responder around annual best,0
3825,,hoop somewhere,incase accident first responder would know baby present,0
3826,,michigan,extend health care first responder,1
3827,,indiana,say working curb first responder suicide,1
3828,,usa,first responder convene national summit award technology,0
3829,,,york first responder compete save life em,0
3830,,dc,good help first responder individual,0
3831,,,life lost except first responder public,1
3832,,basking nj,first responder get free detail,0
3833,,tameside,emergency service meeting brave police first responder help keep,1
3834,,,week first responder dart member four day intensive technical large,1
3835,,ca,make gain jerry brown heading area meet first responder tomorrow morning,1
3836,,tn near nashville,shooting event theater giving free coffee first responder police,1
3837,,missouri,lender fee veteran first responder,0
3838,flame,bandung,new giant flame full black,1
3839,flame,new york,snap tool black baseball flame full,0
3840,flame,new york,snap tool black baseball flame full,0
3841,flame,ky,going table flame,0
3842,flame,,cabin fever flame,0
3843,flame,ny,summon flame directly hell store bought,0
3844,flame,freeport ny,added fire flame rick wonder spinning guest set along,0
3845,flame,,yoga,0
3846,flame,,flame make good penalty,0
3847,flame,dreamy lake,guess say hope went flame,0
3848,flame,,cry pity flame,0
3849,flame,houstn,new chance nothing flame,0
3850,flame,hell,wish good enough add flame nail fire,1
3851,flame,nc,gang walking round brown thats,0
3852,flame,new york,snap tool black baseball flame full,0
3853,flame,purgatory,dude smoking thing went flame though bomb went,1
3854,flame,,mansion fire plug tree report say,1
3855,flame,cockerelshoes,new giant flame manly,0
3856,flame,united state,see devastation continue battle flame report,1
3857,flame,manaus,watching go flame,1
3858,flame,sioux,said see smoke coming silo street,1
3859,flame,,chose search joy two near smile matter cold flame burn bod,0
3860,flame,republica dominicana,mansion fire plug tree report say,1
3861,flame,oh,everyone setting flame upon,0
3862,flame,va,optimistic side doubt feel like game pivot,0
3863,flame,,mansion fire plug tree report say,1
3864,flame,,pardon burst enough world mindless game,0
3865,flame,travelling around world,want burst,0
3866,flame,kentwood mi,catching flame slaughter,1
3867,flame,,let,0
3868,flame,,opinion put,0
3869,flame,jet life,rising follower follower past get right,0
3870,flame,fairy,gray red flame blazing around person setting nearly everything,1
3871,flame,santo domingo alma rosa,mansion fire plug tree report say,1
3872,flame,somewhere around,mansion fire plug tree report say,1
3873,flame,houston corsicana,better make shot tomorrow cause recording flame thrown tomorrow,0
3874,flame,oh,added video flame,0
3875,flame,bacon,better admit flame better,0
3876,flame,,advantage apropos flame favorable regard,0
3878,flattened,chicago,road success penny train track,0
3879,flattened,manchester,feel like wrestler pain gain strong,0
3880,flattened,nh,idea,0
3882,flattened,england,absolutely guy,0
3884,flattened,victoria,year ago first atomic attack day later war crime put place,1
3885,flattened,uk,today anniversary outright city,1
3886,flattened,england,would little midget,0
3887,flattened,new ny,said sam vote rabbit skin huh always,0
3888,flattened,somewhere cold,lose lost fight guy lost also,1
3889,flattened,barbados,bird get de cup lag bout pun de dock watch,0
3890,flattened,,foot instead kick get hand,0
3891,flattened,leeds,thee striker,1
3892,flattened,nd,hay men masonite,0
3894,flattened,uk,building set one city iconic building disappearing,0
3895,flattened,,hide hide thought ball,0
3896,flattened,,great little,0
3897,flattened,,ball,0
3898,flattened,ventura,doubt implicit statement make want,0
3899,flattened,le memenet,imperfect marine generic western,0
3900,flattened,texas,think risk losing getting nose lot,0
3901,flattened,derby,literally picked new car today battery already trying sort,0
3902,flattened,ontario,harper ten thousand slave cost job,0
3904,flattened,england,imagine getting,0
3905,flattened,,fallacy steam object whether,0
3906,flattened,md,beach earring beach jewelry vacation earring keep calm beach earring made,0
3907,flattened,,mix new flat double sided bottle cap choose mix full,0
3908,flattened,east mi,flat like crushing back hail,0
3909,flattened,rocketing galaxy,ever seen dreamy look came face ear walk slowly toward,1
3910,flattened,new york,mix new flat double sided bottle cap choose mix full,0
3911,flood,boston,fizzy sitting regular flood seat one know,0
3912,flood,united state,cancel flash flood warning bell,1
3913,flood,new york,spot flood curved cree led work light bar fog lamp full,1
3914,flood,new york,spot flood curved cree led work light bar fog lamp full,0
3915,flood,australia,flood,1
3916,flood,british canada,queen way home flood,1
3917,flood,,cree led work light lamp car truck boat mining flood beam full,0
3918,flood,,since left see always without give,0
3919,flood,,yet still many fish die,0
3920,flood,philadelphia,please flood poor put,1
3921,flood,new york,spot flood curved cree led work light bar fog lamp full,0
3922,flood,van mo,didnt,0
3923,flood,new york,cree led work light bar alloy spot flood diving boat full,0
3924,flood,new york,cree led work light lamp car truck boat mining flood beam full,1
3925,flood,niagara ontario,cue flood people calling,0
3926,flood,usa,motor hot deal led work light flood lamp tractor truck,0
3927,flood,,led warm white light motion sensor outdoor flood light pir lamp,0
3928,flood,hawaii usa,county official report coastal flood,1
3929,flood,new york,pair new round led work driving flood light full read,0
3930,flood,new york,cree led work light lamp car truck boat mining flood beam full,0
3931,flood,,flood defective soul mate milk trench,1
3932,flood,,issue areal flood advisory till,1
3933,flood,new york,cree led work light lamp car truck boat mining flood beam full,0
3934,flood,usa,flood advisory effect county al,1
3935,flood,united state,grant fund meeting flood grant set night,1
3936,flood,new york,spot flood curved cree led work light bar fog lamp full,0
3937,flood,new york,spot flood curved cree led work light bar fog lamp full,0
3938,flood,new york,spot flood curved cree led work light bar fog lamp full,0
3939,flood,united state,flood advisory august,1
3940,flood,,head god survive,0
3941,flood,new york,spot flood curved cree led work light bar fog lamp full,0
3942,flood,usa,flood prone waterway county eligible million state aid,1
3943,flood,waddesdon,rescue team help flood victim,1
3944,flood,tn,flood advisory august august urban weather,1
3945,flood,new york,cree led work light bar alloy spot flood diving boat full,0
3946,flooding,rock wy,rock spring resident living elk street continue battle flooding issue rain,1
3947,flooding,vietnam,leader sympathy flooding,1
3948,flooding,fl,business sponge dock washed rain,1
3949,flooding,,thrust little jam cock deep inside flooding womb pussy hot thick cum,0
3950,flooding,usa,severe thunderstorm flash flooding possible weather environment climate nature,1
3951,flooding,alabama,radar widespread moving flooding possible,1
3952,flooding,nova canada,tip prevent basement leak create control joint eliminate random flooding,0
3953,flooding,,flooding,1
3954,flooding,metro manila,flooding po,0
3955,flooding,,flooding kill displace one million daily news analysis,1
3956,flooding,breaking news,flooding kill displace one million daily news analysis,1
3957,flooding,,flooding village underwater world vision,1
3958,flooding,uk,flood trekker amid flash flood group flooding,1
3959,flooding,,maybe plan dilute safely say start charging longs would come flooding,0
3960,flooding,vietnam,leader sympathy flooding,1
3961,flooding,,ill hotel people flooding notification,0
3962,flooding,accept song request,wave flooding find way home look,1
3963,flooding,hawaii,flooding home stop mold growth via,1
3964,flooding,,flooding track derailment sa,1
3965,flooding,miami fl,flooding market like never,0
3966,flooding,republic texas,keep asylum seeker flooding via,1
3967,flooding,usa,grateful support flooding dinner thank,1
3968,flooding,huntsville al,flash flooding,1
3969,flooding,,soon start flooding comment section,0
3970,flooding,run,last year lot drum,0
3971,flooding,west midland,burst water main cause major flooding hospital,1
3972,flooding,,heavy rainfall flooding northern situation report,1
3973,flooding,,oh god memory flooding back,0
3974,flooding,,flood disaster burst water pipe flood apartment senior center water pipe flood,1
3975,flooding,,look feel flooding back,0
3976,flooding,,thousand worst flooding decade hit part,1
3977,flooding,ocean nj,resident central part ocean city engineer flood mitigation option,1
3978,flooding,,wen finally get girl want flooding wit pic tho,0
3979,flooding,belleville,see flooding mad decent,0
3980,flooding,kualar malaysia,monsoon flooding kill dozen call help,1
3981,flooding,tx,memorial unveiled travis county deputy travis county sheriff,1
3982,flooding,,flooding kill displace one million least people nearly,1
3983,flooding,nadiad,much flooding superb love always,0
3984,flood,south,slip sliding away flash flood writer nester,1
3985,flood,,tornado climate god quote,1
3986,flood,adventist lesson sabbath,heavy monsoon rain month flooding flash flood,1
3987,flood,australia,people taken shelter relief camp government set,1
3988,flood,,worry sure climate nothing hail flood tornado sure mad,1
3989,flood,passamaquoddy,never thought would moment yet month degree flash,1
3990,flood,,like half town flood rain still whatever,1
3991,flood,australia,site multiple story high rise building next low density character residential area flood,0
3992,flood,canada,hope mountain dew throat flood lung leaving drown death,1
3993,flood,michigan,disaster group flood,1
3994,flood,london,person reckon dying brain flood causing relive life real time simulation,0
3995,flood,,ever old song something word carry flood memory priceless,0
3996,flood,california,flood fishing finally sunshine deal anniversary sale paint beautiful life,0
3997,flood,,flood disaster blame claim state use economic,1
3998,flood,,dead due flood death toll rose today,1
3999,flood,estados unidos,typhoon approach missing flood via,1
4000,flood,new jersey,rain flash otherwise desert grief,1
4001,flood,new ny,jazz art music,0
4002,flood,timaru new zealand,flood dam every bit water charging,1
4003,flood,cameroon,flood kill animal bird,1
4004,flood,st cornwall,hope rain throughout whole weekend hope flood become,0
4005,flood,nigeria,chieftain task flood donation,1
4006,flood,philippine,yellow warning island possible flood area landslide mountainous,1
4007,flood,,government declared flood continue,1
4008,flood,north america,nearly thousand people affected flood,1
4009,flood,earth,blame claim state use relief even flood,1
4010,flood,,may help suffering family,1
4011,flood,,child face flood hit,1
4012,flood,new usa,love drake flood make feel real tune everything like,0
4013,flood,,tornado climate god quote,0
4014,flood,,die flood affected,1
4015,flood,,typhoon approach missing flood typhoon,1
4016,flood,,always flood,1
4017,flood,,flood cause damage death across medium content,1
4018,flood,rio de janeiro,soon maintenance end everyone flood extreme start anew,0
4019,flood,,tornado climate god quote,0
4020,,,solid combust fossil fuel voltaic active forest fire biological bacteria decomposition,1
4021,,pdx,careful anyone life west forest grove rapidly spreading fire heading east,1
4022,,shelby county,added video bind forest,1
4023,,,one careless match start forest fire take whole box start,1
4024,,port matilda pa,little forest fire warden,1
4025,,,fire national forest acre,1
4026,,usa,manzanita timber fire along ridge forest road,1
4027,,,setting forest fire bite,1
4028,,,forest,1
4029,,,video cole fire squad forest hill,0
4030,,usa,view smoke column rising south end blake fire along forest road,1
4031,,,start forest fire cannot put,1
4032,,nc,fire national forest acre,1
4033,,,grill school one grill going pretty much either forest made work,0
4034,,,watch forest fire smoke run pet store,1
4035,,los angeles,forest fire fire watch,1
4036,,,forest service national temporarily,1
4037,,western washington,acronym united state fire,0
4038,,atlanta,one careless match start forest fire take whole box start campfire,0
4039,,,prevent forest,1
4040,,,fire rage forest service sound alarm rising wildfire,1
4041,,,duck big flat stamp forest elephant big flat stamp flaming,0
4042,,canada,rest summer usually worry forest hour,1
4043,,,fire rage forest service sound alarm sharply rising wildfire cost,1
4044,,,little concerned number forest fire living,1
4045,,,trump climate algae bloom pacific forest snowball,1
4046,,montana,forest service budget fighting fire,1
4047,,,cartoon without would forest fire toilet,0
4048,,,first year forest service spent half annual budget fighting,1
4049,,,fire rage forest service sound alarm rising wildfire cost,1
4050,,,lightning spark new fire national forest,1
4051,,san francisco,spread conflict sparked increase fire forest throughout,1
4052,,cape cod,blue,1
4053,,,cook bear saving forest fire face as,0
4054,,nicola valley,forest fire dying time act climate change nightmare,1
4055,,tip blog,tale tree deep water loving lake forest fire,0
4056,,idaho,progress made forest,1
4057,,,group forest service could help contain detail,1
4058,,,east coast forest put,1
4059,,duncan,brave angel instead dumping water please send help forest fire,1
4060,,,forest service say spending half budget fire,1
4061,,texas,prevent forest fire,0
4062,,,climate forest service say spending half budget fire,1
4063,,,forest service say spending half budget fire,1
4064,,based ca serve nationwide,property loss northern wildfire nearly double via,1
4065,,oregon,rogue national forest fire,1
4066,,bc,forest fire could delay official say could good thing,1
4067,,,forest service say spending half budget,1
4068,,,recommendation shop stream,1
4069,,,ur friend talking forest fire forest tell drop ur mix tape,1
4070,,ca,forest service budget spark political forest service report cite increasing cost,1
4071,hail,carol illinois,great michigan technique thanks,1
4072,hail,,sevenfold hail king,0
4073,hail,,hail shadow mix mike,1
4074,hail,,like big hail cannot,0
4075,hail,united state,issue severe thunderstorm warning sharp till,1
4076,hail,,two great dak hail state,0
4077,hail,arkansas,strong thunderstorm mile north moving se large hail wind gust,1
4078,hail,united state,issue severe thunderstorm warning till,1
4079,hail,,thank much everyone posting rain hail outside idea guy,0
4080,hail,essex,everyone hail pumpkin,0
4081,hail,inside beltway,cue storm massive wind power outage,1
4082,hail,,hopefully epic hail storm,0
4083,hail,usa,strong thunderstorm mile north moving se large hail wind gust,1
4084,hail,usa,hail lady reason cole,0
4085,hail,,look like bowl weather sugar stay crunchy even,0
4086,hail,,hail mary full grace lord blessed art thou among woman blessed fruit,0
4087,hail,fortaleza ce,seen hail,0
4088,hail,,hail plus car even gotten yet another killer migraine lost,1
4089,hail,paradise city,hail cloud,0
4090,hail,rapid south dakota,new warning central hill hail affecting could later,1
4091,hail,antoine fisher,man,0
4093,hail,,heavy rain lightning overhead least melt,1
4094,hail,ab,heavy rain hail,1
4095,hail,calgary,come,1
4096,hail,,coming sized hail yesterday sunny amazing sky,0
4097,hail,,central fruit tree escape heavy damage wind hail,1
4098,hail,,new warning central hill hail affecting could later,1
4099,hail,united state,severe thunderstorm warning fall river till,1
4100,hail,bay ca,tan say hail chef green pasture feature sustainable organic,0
4101,hail,la nevada,hail new,0
4102,hail,global,hail second day storm,1
4103,hail,watch video,pull,0
4104,hail,oklahoma,showing storm ne severe hail wind,1
