,keyword,location,text,labels
5471,quarantine,area,still eaten since still clean dry lot fill water may,0
5472,quarantine,,check quarantine offensive,0
5473,quarantine,india,update content policy promise quarantine community,0
5474,quarantine,,update content policy promise quarantine community,0
5475,quarantine,,quarantine offensive,0
5476,quarantine,,quarantine offensive content,0
5477,quarantine,,quarantine,1
5478,quarantine,mumbai,wired quarantine offensive content,0
5479,quarantine,killa co,quarantine offensive unveiled,0
5480,quarantine,southern califorina,quarantine offensive unveiled,0
5481,quarantine,world,wired business quarantine offensive content,0
5482,quarantine,san,quarantine offensive content,0
5483,quarantine,,quarantine offensive content wired,0
5484,quarantine,,quarantine offensive content unveiled,0
5485,quarantine,,tweet wired,0
5486,quarantine,,yet another company trying censor quarantine,0
5487,quarantine,new york,quarantine offensive unveiled,0
5488,quarantine,usa,quarantine,0
5489,quarantine,lctea,quarantine offensive unveiled,0
5490,quarantine,new united state,quarantine offensive content,0
5491,quarantine,,quarantine offensive content,0
5492,quarantine,,quarantine,0
5493,quarantine,london,update content policy promise quarantine community,0
5494,quarantine,san ca,much game pink sit design quarantine,0
5495,quarantine,world,quarantine offensive content,0
5496,quarantine,,quarantine,0
5497,quarantine,,quarantine offensive content,1
5498,quarantined,,top new content policy go effect many horrible,0
5499,quarantined,,little corner sick office work piling need day,0
5500,quarantined,ga,new content policy go effect many horrible,0
5501,quarantined,korea,top new content policy go effect many horrible,0
5502,quarantined,south africa,hot new content policy go effect many horrible best,0
5503,quarantined,san francisco,home possible case,1
5504,quarantined,russia,hot new content policy go effect many horrible best,0
5505,quarantined,california,new content policy go effect many horrible,0
5506,quarantined,,go run,1
5507,quarantined,fl,new content policy go effect many horrible,1
5508,quarantined,,yes triggered,0
5509,quarantined,melbourne,hot new content policy go effect many horrible best,1
5510,quarantined,mi,new content policy go effect many horrible,0
5511,quarantined,,user sub,0
5512,quarantined,,home possible,1
5513,quarantined,usa,calling get end,0
5514,quarantined,karolinska solna,official say quarantine place home possible khan,1
5515,quarantined,,home possible case time,1
5516,quarantined,,top new content policy go effect many horrible,0
5517,quarantined,,new content policy go effect many horrible,0
5518,quarantined,china,top new content policy go effect many horrible,0
5519,quarantined,,home possible official say quarantine place,1
5520,quarantined,heard,home possible case,1
5521,quarantined,,going say new policy change think bad truth,0
5522,quarantined,ga,cat really loud turned might work,0
5523,quarantined,,possible exposure report,1
5524,quarantined,,home possible case news,1
5525,quarantined,ebola,home possible ambulance sat outside university,1
5526,quarantined,mongolia,hot new content policy go effect many horrible best,0
5527,quarantined,,new content policy go effect many horrible,0
5528,quarantined,broadview ohio,hey concept make sense people wander whenever want,0
5529,quarantined,,home possible related,1
5530,quarantined,,home possible case post,1
5531,quarantined,china,top new content policy go effect many horrible,0
5532,quarantined,london,patch fix error computer stopped wireless technology,0
5533,quarantined,rome,top new content policy go effect many horrible,0
5534,quarantined,china,hot new content policy go effect many horrible best,0
5535,,mn usa,nuclear emergency current radiation level site,0
5536,,,video canada radiation update emergency fishing closure,1
5537,,,emergency slightly elevated level,1
5538,,vt,worst radiation exposure small emergency zone cut,1
5539,,la grange il,facility investigating site filter radiation emergency say,0
5540,,warszawa,radioactive box port emergency team discovered radiation,1
5541,,dc,radiation emergency preparedness start knowing get inside stay inside stay tuned via,1
5542,,,else want document radiation emergency procedure radiation emergency procedure,0
5543,,maygodhelpus,radiation nuclear emergency,0
5544,rainstorm,prince edward island,due rainstorm last night cupcake happening proceeds,0
5545,rainstorm,,rainstorm downtown,1
5546,rainstorm,vancouver usa,forgot,0
5547,rainstorm,alberta,wow beauty lie within every taken today rainstorm,1
5548,rainstorm,yobe state,rainstorm house rainstorm house,1
5549,rainstorm,rhode island,going beach mean lucky,0
5550,rainstorm,,edge jimmy summer rainstorm via,0
5551,rainstorm,united state america,people severe rainstorm alp,1
5552,rainstorm,,landslide alp kill three people severe rainstorm,1
5553,rainstorm,federal capital territory,rainstorm house via,1
5554,rainstorm,la ca,stuck stay toward middle street crowned water pool,0
5555,rainstorm,,major rainstorm lie drift away storming around little,1
5556,rainstorm,online,landslide alp kill three three people severe rainstorm,1
5557,rainstorm,tn,roar wave rainstorm,0
5558,rainstorm,,two vacancy castle fantasy football join,0
5559,rainstorm,,look like got caught rainstorm amazing disgusting time,0
5560,rainstorm,,rainstorm north,1
5561,rainstorm,thailand malaysia indonesia,rainstorm house,1
5562,rainstorm,earth,landslide alp kill three people severe rainstorm,1
5563,rainstorm,usa,rain rain go soaker way,0
5565,rainstorm,va,evening commute red rainstorm region push way late,1
5566,rainstorm,tn,rainstorm last nearly long enough,1
5567,rainstorm,seattle,interested font,0
5568,rainstorm,british columbia,drove deep water flash repair cost yr later people still car,1
5569,rainstorm,north citizen,best believe wrong decision made street rainstorm folk doe,0
5570,rainstorm,england,want rainstorm please,0
5571,rainstorm,porto rio grande sul,waking sick rainstorm outside would usually make today put stereo,0
5572,rainstorm,north bc,feel wind gearing rainstorm bring drought wildfire,1
5573,rainstorm,seattle,huge football fan know never done fantasy patience,0
5574,rainstorm,pioneer ky,way move like full rainstorm house,1
5575,rainstorm,port nigeria,rainstorm house state,1
5576,rainstorm,,way move like full rainstorm house,0
5577,rainstorm,uk,landslide severe rainstorm kill,1
5578,razed,,former freedom make way new home,0
5579,razed,,home northern wildfire news,1
5580,razed,nigeria,tension governor react,1
5581,razed,ok,home northern latest wildfire burning,1
5582,razed,,home northern wildfire,1
5583,razed,,home northern wildfire news,1
5584,razed,,home northern wildfire news,1
5585,razed,,home northern wildfire news advance,1
5586,razed,worldwide,news home northern wildfire new york time,1
5587,razed,,home northern wildfire news,1
5588,razed,,home northern wildfire news,1
5589,razed,,home northern wildfire,1
5590,razed,,home northern wildfire,1
5591,razed,,home northern wildfire,1
5592,razed,north,significant think iconic pic church ruin substantial effort,0
5593,razed,,home northern wildfire,1
5594,razed,,home northern wildfire,1
5595,razed,,home northern wildfire news,1
5596,razed,ia,least sincere,1
5597,razed,,home northern wildfire news,1
5598,razed,,home northern wildfire news,1
5599,razed,,home northern wildfire,1
5600,razed,san diego california,home northern wildfire,1
5601,razed,,hero saved burning friend wildfire,1
5602,razed,pa,today another yesterday check today,0
5603,razed,,home northern wildfire news,1
5604,razed,,home northern wildfire news,1
5605,razed,,home northern wildfire news,1
5606,razed,,home northern wildfire news,1
5607,razed,,home wildfire,1
5608,razed,,home northern wildfire,1
5609,razed,,hero saved burning friend,1
5610,razed,,home northern wildfire,1
5611,razed,,home northern wildfire news,1
5612,razed,,house make way public gazebo,0
5613,refugee,,couple gave refugee incredible gift fed instead family,1
5614,refugee,ad majorem dei glorium,police via,1
5615,refugee,ontario,newlywed donate wedding money beautiful still faith,0
5616,refugee,baku erzurum,couple gave refugee incredible gift,1
5617,refugee,statute,dupe press,0
5618,refugee,paradise,refugee due,1
5619,refugee,asia,newlywed feed refugee wedding news latest canada world entertainment business news,0
5620,refugee,,refugee,1
5621,refugee,,refugee,1
5622,refugee,,refugee,1
5623,refugee,st petersburgfl,entire aisle making people look like director whole food clothing section,0
5624,refugee,,spend wedding day feeding see,0
5625,refugee,,refugee,1
5626,refugee,tarragona,top spend wedding day feeding see,0
5627,refugee,,refugee connection campaign going live support help launch community,1
5628,refugee,,read refugee,1
5629,refugee,,short throwing overboard think leader could much worse refugee worst,1
5630,refugee,warri,refugee,1
5631,refugee,melbourne australia,captain must go boat refugee,0
5632,refugee,,couple spent wedding day feeding refugee couple got,0
5633,refugee,,one couple drone save refugee border,1
5634,refugee,,refugee,1
5635,refugee,,refugee,1
5636,refugee,india,couple decided feed refugee part wedding celebration,0
5637,refugee,skyhold,right two year still refugee south village,1
5638,refugee,australia,newlywed feed thousand refugee instead hosting banquet wedding dinner age news,0
5639,refugee,,young refugee forced flee violence vice news see,1
5640,refugee,tripoli international airport,un refugee thank un refugee helping many people need,0
5641,refugee,,refugee,0
5642,refugee,,newlywed feed thousand refugee instead hosting banquet wedding dinner via,1
5643,refugee,new zealand,medium protest new security gag,0
5644,refugee,,refugee,1
5645,refugee,colombia,generous bride couple feed refugee wedding day via love,0
5646,refugee,,refugee,1
5647,refugee,qld australia,returned refugee treat presser,1
5648,refugee,switzerland,follower visit dream exhibition,1
5649,rescue,trinidad tobago,policyholder object rescue plan,1
5651,rescue,harleychickpjntrunbenrun,coastal german shepherd rescue,0
5652,rescue,ontario,rescue road road york,1
5653,rescue,new jersey,rescue world cat day black cat,0
5654,rescue,big northeast litter box,blood pressure still probably long story broke involved animal rescue,0
5655,rescue,sand spring oklahoma,coastal german shepherd rescue,0
5656,rescue,,coastal german shepherd rescue,0
5658,rescue,surry sydney,length rescue cat,0
5659,rescue,sand spring oklahoma,last chance animal rescue new,0
5660,rescue,harleychickpjntrunbenrun,last chance animal rescue new,0
5661,rescue,,sammy always rescue may uniform still rescue forever,0
5662,rescue,usa,lunch crew night night long,0
5663,rescue,thornton colorado,tell united plantation via,0
5664,rescue,wanderlust,mary coming troy,0
5665,rescue,ontario,rescue road road york,1
5666,rescue,karachi,general visit also effort army troop army aviation rescue,1
5667,rescue,,last chance animal rescue new,0
5668,rescue,,many dog rescue,0
5669,rescue,india,official rescue migrant body found fox news news,1
5670,rescue,fema region,coastal german shepherd rescue,0
5671,rescued,united state,dad dude kept since,1
5672,rescued,,amid flood,1
5673,rescued,nigeria,lady police tribune,1
5674,rescued,jakarta,migrant arrive,1
5675,rescued,usa,hand glass water sit lived ship around,0
5676,rescued,watford,get dopey hilarious shame probably going die,0
5677,rescued,west hollywood,summer puppy happy,0
5678,rescued,kent,man buried dog alive thought one would find time,0
5679,rescued,canada,baby girl half mile,1
5681,rescued,usa,migrant arrive,1
5682,rescued,bournemouth,hip hop pioneer paleface drifting brought container later,0
5683,rescued,jammu kashmir delhi,bovine,1
5684,rescued,,fund abandoned cocker spaniel,0
5685,rescued,,video sick,0
5686,rescued,,news amid flood,1
5687,rescued,southern california,brave little dog get recovery via,0
5688,rescued,pennsylvania usa,homeless man traveling across stray dog get helping hand stranger via,0
5689,rescued,,breaking news tonight play room week food water parent sex life,1
5690,rescued,nc,actually pretend,0
5691,rescued,il,dog least year ago old still sweet ever,0
5692,rescued,nigeria,migrant arrive hundred migrant,1
5693,rescued,green pleasant,taken back,1
5694,rescued,earth,migrant boat,1
5695,rescued,,young child among boat via,1
5696,rescued,,springer spaniel dog dad baby,1
5697,rescued,,trust get dopey,0
5698,rescued,ireland,three beached whale kerry,1
5699,rescued,,go ribbon via,0
5700,rescued,,turn back swept away sin though contemporary version,0
5701,rescued,usa,pet like part love last pet break heart animal,0
5702,rescued,boston,video homeless dog living cardboard box get,0
5703,rescued,canada,angry mistrustful elephant find peace friendship new home via,0
5704,rescued,,hundred migrant await disembarkment naval vessel,1
5705,rescued,cape town,migrant arrive,1
5706,rescuer,nigeria,body rescuer searching hundred migrant news,1
5707,rescuer,westerland,body rescuer searching hundred migrant,1
5708,rescuer,kuala lumpur,body rescuer searching hundred migrant,1
5709,rescuer,surabaya,body rescuer searching hundred migrant,1
5710,rescuer,iminchina,body rescuer searching hundred migrant,1
5711,rescuer,,world fear missing migrant rescuer search survivor boat carrying many news,1
5712,rescuer,africa,rescuer searching hundred migrant mediterranean boat,1
5713,rescuer,,unexplainable desire watch,0
5714,rescuer,nigeria,fear missing migrant rescuer search survivor boat carrying,1
5715,rescuer,birmingham,channel dog crept back,0
5716,rescuer,,body rescuer searching hundred migrant mediterranean boat,1
5717,rescuer,,guide rescuer injured county,1
5718,rescuer,,body rescuer searching hundred migrant,1
5719,rescuer,london,body rescuer searching hundred migrant,1
5720,rescuer,,body rescuer searching hundred migrant mediterranean boat,1
5721,rescuer,,body rescuer searching hundred migrant news,1
5722,rescuer,,last second bid rescuer nan five venom kung fu,0
5723,rescuer,,body rescuer searching hundred migrant mediterranean boat,1
5724,rescuer,,body news searching hundred,1
5725,rescuer,thailand,body rescuer searching hundred migrant,1
5726,rescuer,,body rescuer searching,1
5727,rescuer,dimension,story power animal rescuer homeless dog future,1
5728,rescuer,,rescuer searching hundred migrant mediterranean boat carrying many people coast,1
5729,rescuer,washington,rescuer trying save hundred migrant via,1
5730,rescuer,usa canada europe asia,body rescuer searching hundred migrant,1
5731,rescuer,worldwide,body rescuer searching hundred migrant,1
5732,rescuer,phoenix,rescuer found barely idea allergic,1
5733,rescuer,,fear missing migrant rescuer search survivor boat carrying many,1
5734,rescuer,,body rescuer searching hundred migrant mediterranean boat,1
5735,rescuer,,guide rescuer injured county,1
5736,rescuer,,fear missing migrant rescuer search survivor boat carrying many,1
5737,rescuer,,rescuer find survivor earthquake buried,1
5738,rescuer,france,rescuer recover body man lake near,1
5739,rescuer,,fear missing migrant rescuer search survivor boat carrying many,1
5740,rescuer,everywhere,body rescuer searching hundred migrant news,1
5741,riot,belgrade,feminist world riot grill pop art,0
5742,riot,india,broad take eight joe root run riot,0
5743,riot,uk,predict,1
5744,riot,,discovered riot,0
5745,riot,,feminist world riot grill art,0
5746,riot,bossland,rascal riot tour atlantic city beach ticket,0
5747,riot,world wide web,feminist world riot grill,0
5748,riot,sweden,seriously tactical riot headquarters,0
5749,riot,east london,keep eye looking lot new team member coming,0
5750,riot,mi,feminist world riot grill pop,0
5751,riot,,booth riot kappa,1
5752,riot,,start big as riot send jail today,0
5753,riot,,riot kit bah part new concept gear coming fashion,0
5754,riot,,discovered riot,0
5755,riot,,video thought riot sandbox mode,0
5756,riot,,broad take eight joe root run riot broad took figure,0
5757,riot,los ca,walk start perfect,0
5758,riot,,feminist world riot grill,1
5759,riot,,time riot really make official satan skin,0
5760,riot,usa,video sick riot shield slide,0
5761,riot,usa,always secret game check secret get riot point,0
5762,riot,ky,drag queen color lead riot well known butch usually,0
5763,riot,los angeles,film watch,0
5764,riot,united kingdom,ally near use get really cause making every riot staff member look,0
5765,riot,space,pop feminist revolution fried,0
5766,riot,,feminist world riot grill,0
5767,riot,sligo ireland,except know riot even make sense credit particular,1
5768,riot,los ca,secret tip get riot point check secret,0
5769,riot,seattle,southeast dirt riot series crown southeast dirt riot series crown,0
5770,riot,tipperary,running riot allotment brightening rainy day,1
5771,riot,mumbai,broad take eight joe root run riot,0
5772,riot,malang,riot police intervene supporter fan clash buildup,1
5773,riot,,discovered riot,0
5774,riot,san ca,cracker white riot,0
5775,rioting,,government police stop rioting eventually eventually skyscraper become,1
5776,rioting,dublin,new tonight sport police presence soccer game stop prevent rioting,0
5777,rioting,,eric shot sheriff guess many people right,1
5778,rioting,spare,kill rioting,0
5779,rioting,surrounded weeaboos,buy lie tell poor people keep,1
5780,rioting,,bloody hell already hyperbole,1
5781,rioting,australia,twitter count rioting financial collapse brazil,1
5782,rioting,,would black dude would rioting,0
5783,rioting,nyc,recently met discus race relation benefit,0
5784,rioting,vidalia ga,people like inevitable rioting lie,0
5785,rioting,ca,rioting,1
5786,rioting,serva fidem,rioting lower league cup final dee dum,1
5787,rioting,,still rioting couple hour left,1
5788,rioting,ohio,plenty black people rioting championship,0
5789,rioting,trapped america,riot next time say rioting change fixed,1
5790,rioting,little house,insurer say rioting cost insurer police number reduced blind fat,1
5791,rioting,tri state,watch run jewel use fact defend rioting socially minded duo take,1
5792,rioting,upstate new york,think twitter keep insomniac rioting wee small,0
5793,rioting,,people rioting justice murderer behind peace,1
5794,rioting,,still rioting,0
5796,rioting,,get money tomorrow rioting,0
5797,rioting,,day rioting riot directed,1
5798,rioting,chicora oakland,rioting happy valley state,0
5799,rioting,,group mascara smeared girl rioting horrific think,1
5800,rioting,,last time high profile name due city household,1
5801,rioting,heart unholy,legal rioting may peaceful thing demonstration,0
5802,rioting,colonial va,sick criminal parent friend rioting give damn officer,1
5803,rioting,,rioting prior decision indictment really making sense,1
5804,rioting,india,ash test match currently interesting stupid congress,1
5805,rioting,weird part wonderland,people rioting everywhere think one,1
5806,rioting,,football hooligan rioting game already match,1
5807,rioting,alabama,rioting,0
5808,rioting,little house,as insurer say rioting cost police number reduced blind fat,1
5809,rioting,cassadaga florida,lived family lived country looter shot sight rioting,1
5810,rubble,georgia,let life reduced keep piling get,0
5811,rubble,nigeria,stock market gem stock market crash via,0
5812,rubble,,go nuclear arm race going make rubble,0
5813,rubble,,stock market crash summer sparked interest bargain,1
5814,rubble,,stock market crash summer sparked interest bargain,0
5815,rubble,,parent impulsive remember coming home room filled dust rubble,0
5816,rubble,,turning rubble disaster brick build house one,0
5817,rubble,,stock market gem,0
5818,rubble,world,stock market gem stock market crash summer,0
5819,rubble,uae,stock market gem,1
5820,rubble,,stock market crash summer sparked interest bargain bull betting,0
5821,rubble,phoenix az,say main hit rubble,1
5822,rubble,italy,stock market gem,0
5823,rubble,london,stock market gem,1
5824,rubble,,search survivor rubble house old city following,1
5825,rubble,,stock market gem,1
5826,rubble,mo,fame shift rubble,1
5827,rubble,united state,stock market gem news,0
5828,rubble,spain china latin,stock market gem stock market crash summer,0
5829,rubble,il,found diamond rubble,0
5830,rubble,west africa,stock market gem,1
5831,rubble,canada,stock market gem,1
5832,rubble,california,stock market gem,0
5833,rubble,made detroit,stock market gem,1
5834,rubble,,new stock market gem,0
5835,rubble,,stock market gem stock market crash summer sparked,0
5836,rubble,tejas,around,0
5837,rubble,atlanta georgia,stock market gem,0
5838,ruin,ca ga,damn let ruin year better start like back day,0
5839,ruin,tn,ruin mood may lost,0
5840,ruin,,ruin everything,0
5841,ruin,depok,quote never let problem ruin,0
5842,ruin,london birmingham,anxious though many watching meet make uncomfortable cant let ruin moment,0
5843,ruin,texas,smoker ruin new car smell,0
5844,ruin,fl,wait friend ruin,0
5845,ruin,austin tx,really sad red tourist ruin everything,0
5846,ruin,,always ruin mood,0
5847,ruin,,understand wanting guy friend give space ruin trust,0
5848,ruin,garrett,like earth would want anybody unhappy purposely ruin somebody happiness,0
5849,ruin,,fresh da shower look loving new hair ruin yes,0
5850,ruin,,see ruin life,0
5851,ruin,sheffield rotherham,well done everyone applaud terrific never ruin anything,0
5852,ruin,maui,four thing may ruin personal injury accident claim,1
5853,ruin,,ruin holiday,0
5854,ruin,oh,every time really good day someone ruin,0
5855,ruin,long ca,ruin ask,0
5856,ruin,belfast,go ruin something minion,0
5857,ruin,fujo garbage heaven,really awful cant even work make artist ruin,0
5858,ruin,new york connecticut,damn wale know ruin,0
5859,ruin,,play like symphony play till finger ruin,0
5860,ruin,,family ruin something actually going good,0
5861,ruin,mile away,hate awkward ruin thing,0
5862,ruin,,long road ruin foo fighter,0
5863,ruin,manitoba,ruin ruined sour cream put brick cheese,0
5864,ruin,,let ruin night,0
5865,ruin,boston,real issue way trying ruin,0
5866,ruin,florida forever,ruin,0
5867,ruin,ca,greedy bastard way ruin censorship,0
5868,ruin,redsoxnation,ruin game great player,0
5869,ruin,mnl,yes dont ruin,0
5870,ruin,,see fresh prince bring back original cast everything nothing ruin,0
5871,ruin,,make ruin keep smiling,0
5872,ruin,ca,people let ruin life soul cervix definitely top,0
5873,ruin,de ia,ruin life,0
5874,ruin,yucatn,babe ruin let stay,0
5875,sandstorm,,everything must listening,0
5876,sandstorm,usa,watch airport get sandstorm minute,1
5877,sandstorm,,watch airport get sandstorm minute,1
5878,sandstorm,united state,wouldnt turn sandstorm riot gave good instead gave dumb least new client,0
5879,sandstorm,,watch airport get sandstorm minute,1
5880,sandstorm,united state,video sandstorm,0
5881,sandstorm,usa,watch airport get sandstorm minute,1
5882,sandstorm,hkxfymhex,watch airport get sandstorm minute,1
5883,sandstorm,,watch airport get sandstorm minute,1
5884,sandstorm,usa,watch airport get sandstorm minute,1
5885,sandstorm,usa,watch airport get sandstorm minute,1
5886,sandstorm,,sandstorm jordan coated middle refugee camp layer grit,1
5887,sandstorm,hamilton,woo,1
5888,sandstorm,united state,watch airport get sandstorm minute,1
5889,sandstorm,usa,watch airport get sandstorm minute,1
5890,sandstorm,usa,watch airport get sandstorm minute,1
5891,sandstorm,usa,watch airport get sandstorm minute,1
5892,sandstorm,,need friend booze sandstorm,0
5893,sandstorm,dakar,sandstorm caravan tent refugee camp,1
5894,sandstorm,united state,watch airport get sandstorm minute,1
5895,sandstorm,usa,watch airport get sandstorm minute,1
5896,sandstorm,usa,watch airport get sandstorm minute,1
5897,sandstorm,usa,watch airport get sandstorm minute,1
5898,sandstorm,usa,watch airport get sandstorm minute,1
5899,sandstorm,head,two hour sandstorm,0
5900,sandstorm,usa,watch airport get sandstorm minute,1
5901,sandstorm,,watch airport get sandstorm minute,1
5902,sandstorm,north usa,put sandstorm,0
5903,sandstorm,usa,watch airport get sandstorm minute,1
5904,sandstorm,usa,watch airport get sandstorm minute,1
5905,sandstorm,usa,watch airport get sandstorm minute,1
5906,sandstorm,wa state,come sandstorm tryout lower,1
5907,sandstorm,usa,watch airport get sandstorm minute,1
5909,sandstorm,tractor land aka bristol,listen sandstorm without,0
5910,sandstorm,,sandstorm radio edit,0
5911,sandstorm,usa,watch airport get sandstorm minute,1
5912,screamed,,phone ground,0
5913,screamed,adventuring narnia,world much love little pony,0
5914,screamed,,police like nice enough felt bad worry,0
5915,screamed,,get getting lyric wrong,0
5916,screamed,,cant stand,0
5917,screamed,asgard,dagger mina leg,1
5918,screamed,san ca,expect drag first song pandora,1
5919,screamed,wallahi,got would cried needle massive ya,0
5920,screamed,,steven universe theme song upstairs name part song cousin,0
5921,screamed,sneaking glance thancred,tweet,0
5922,screamed,,girl next,0
5923,screamed,north carolina,thought goal ever goal,0
5924,screamed,,ran realize mean probably politely say hi,0
5925,screamed,,got dad move half step could get,0
5926,screamed,nirvana,dead as believe,0
5927,screamed,,stop believing came radio restaurant white bit mommy,0
5928,screamed,ny,face timed concert minute straight,0
5929,screamed,mentor oh,make tweet much dislike today movement want,0
5930,screamed,arkansas,people right ear week still day,0
5931,screamed,cc,going leadership camp came work today bathroom inner miss camp,0
5932,screamed,north usa,vacation great aunt spider bare hand fierce,1
5933,screamed,,want cheat feel good vent twitter without,0
5934,screamed,,sorry wild show like show singing steal girl literally shut,0
5935,screamed,ag,language good,0
5936,screamed,,end,0
5937,screamed,,never loud,0
5939,screamed,,top lung said guy would come back keep promise,0
5941,screamed,sisterhood,literally concert soul blessed,0
5945,screamed,,dont even remember happening remember like light turned everyone encore,0
